image_number,image,text,egyptian
2066.0,2490365757_b869282cb3.jpg,رجل يلتقط صوراً لحديقة كبيرة من زهور التوليب البيضاء والبرتقالية,راجل بيصور حديقة كبيرة من زهور التوليب البيضا والبرتقالية
2067.0,2490687446_9d46fdf5a9.jpg,كلب أسود ينفض الماء من على جسده,كلب اسود بيهز المية من على جسمه
2068.0,2490768374_45d94fc658.jpg,فتاة صغيرة مبتسمة ترتدي تنورة,بنت صغيرة مبتسمة بلبس تنورة
2069.0,2490863987_715383944a.jpg,متشرد يحمل لافتة يطلب الحصول على النقود لشراء بيرة وطعام وعاهرة,متشرد شايل لافته بيطلب فلوس عشان يشتري بيرة واكل و...
2070.0,2491343114_a3e35a2a3a.jpg,كلب يركض على الشاطئ,كلب بيجري على الشط
2071.0,2492258999_5764124bba.jpg,رجلان بلا مأوى يجلسان بجوار مبنى به عربة تسوق,اتنين رجالة مشردين قاعدين جنب مبنى فيه عربية تسوق
2072.0,2493469969_11b6190615.jpg,كلب أشقر يقفز في الهواء على العشب,كلب اشقر بيقفز في الهوا على العشب
2073.0,249394748_2e4acfbbb5.jpg,تلعب الكلاب البيضاء في حقل,كلاب بيضا بتلعب في حقله
2074.0,2493974889_50ae29f1e1.jpg,صبيان يسيران على طريق ترابية تصطف على جانبيه الأشجار,اتنين ولاد ماشيين على طريق تراب جنبها شجر
2075.0,2495394666_2ef6c37519.jpg,كلب بني يقف في بحيرة,كلب بني واقف في بحيرة
2076.0,2495931537_9b8d4474b6.jpg,كلب بني يشم كلب أبيض مستلق على الأرض,كلب بني بيشم كلب ابيض نايم على الأرض
2077.0,2496236371_61dec88113.jpg,رجل على دراجة نارية يفعل حركة بهلوانية بالدراجة على المسار,راجل على موتور بيعمل حركة بهلوانية بالدراجة على المضمار
2078.0,2496370758_a3fbc49837.jpg,كلب أبيض وكلب أسمر يمران عبر حقل عشبي,كلب ابيض وكلب بني بيمشوا في حقله عشب
2079.0,2496399593_a24954a5ca.jpg,سيدة بنية الشعر تبتسم للكاميرا أمام الأشجار,ست شعرها بني بتبتسم للكاميرا قدام الشجر
2080.0,2497074804_b4f3e7fd90.jpg,رجل في قميص أبيض يقف في الخارج في شارع مزدحم,راجل بلبس قميص ابيض واقف بره في شارع زحمة
2081.0,2497420371_74788d7ba1.jpg,رجل يعبث بحقيبة تسوق خارجا بالقرب من عربة التسوق,راجل بيعبث في شنطة تسوق بره قريب من عربية التسوق
2082.0,2497608431_8dfefc7a1a.jpg,رجل يستعد لرمي عصا مخصصة لكلب أسود أمامه لجلبها,راجل مستعد يرمي عصاية مخصوصة لكلب اسود قدامه عشان يجيبها
2083.0,2498897831_0bbb5d5b51.jpg,ثلاث فتيات صغيرات يجلسن على مقعد أرجواني ويصنعن وجوه مضحكة,تلات بنات صغيرين قاعدين على كرسي بنفسجي وبيعملوا وشوش مضحكة
2084.0,2500354186_0836309cc9.jpg,طفل صغير يحمل طارة كبيرة,ولد صغير شايل طارة كبيرة
2085.0,2500567791_101d5ddee3.jpg,بقرة سوداء وبقرة بنية يطاردون كلب,بقرة سودا وبقرة بنية بيجريوا ورا كلب
2086.0,2500826039_165e75b20c.jpg,قبلات زوجين على رصيف مزدحم,اتنين بيبوسوا بعض على رصيف زحمة
2087.0,2501595799_6316001e89.jpg,يقفز صبي صغير إلى حوض سباحة للأطفال في الهواء الطلق,ولد صغير بيقفز في حمام سباحة للاطفال في الهوا
2088.0,2501742763_b2cb322087.jpg,كلب أسود يركض في العشب,كلب اسود بيجري في العشب
2089.0,2501942587_e59b91d1da.jpg,مجموعة من الناس يمشون في كرنفال,مجموعة من الناس ماشيين في كرنفال
2090.0,2501968935_02f2cd8079.jpg,رجل يلبس قميصًا أرجوانيًا ومنديل أحمر يبتسم  للأشخاص الذين يشاهدونه,راجل لابس قميص بنفسجي وروب أحمر بيبتسم لناس بتشوفه
2091.0,2502007071_82a8c639cf.jpg,مجموعة من الناس أمام منزل,مجموعة من الناس قدام بيت
2092.0,2502079538_10ef2e976b.jpg,جمل يحمل حاجيات شخصين ,جمل شايل حاجات اتنين
2093.0,2502354602_f4d6dcf42d.jpg,ينظر العروس والعريس إلى بعضهما البعض في صورة سخيفة,العروس والعريس بيبوصوا لبعض في صورة سخيفة
2094.0,2502782508_2c8211cd6b.jpg,رجل في قبعة ونظارات شمسية يقرأ كتابا على مقعد في الحديقة,راجل بلبس كاب ونظارة شمس بيقرأ كتاب على كرسي في الحديقة
2095.0,2502835694_4fe121bbea.jpg,مجموعة من الناس خارج مبنى حجري يلتقطون الصور,مجموعة من الناس بره مبنى حجري بيصوروا
2096.0,2502856739_490db7a657.jpg,يجري كلب أسود وكلب ذهبي وكلب أبيض وأسود في حديقة,كلب اسود وكلب ذهبي وكلب ابيض واسود بيجريوا في حديقة
2097.0,2502905671_c6039804ab.jpg,كلب ينتظر الرجل أن يرمي الكرة في المحيط,كلب مستني الراجل يرمي الكرة في البحر
2098.0,2502935765_a0ae1fa7be.jpg,صبي يدور في ملعب الحديقة,ولد بيدور في ملعب الحديقة
2099.0,2503629305_055e9ec4b1.jpg,كلب يركض عبر العشب,"كلب بيجري في العشب
"
2100.0,2504056718_25ded44ecb.jpg,كلب أبيض وأسود يقفز للقبض على الصحن الطائر الأخضر,كلب أبيض وأسود بيقفز عشان يمسك الطبق الطائر الأخضر
2101.0,250406927_a5028a31d4.jpg,كلب أسود يوازن كرة قدم على أنفه,كلب أسود بيوازن كرة قدم على مناخيره
2102.0,2504277798_936a09c74d.jpg,امرأة تمارس إطلاق النار من بندقيتها ضمن مجال الرماية,ست بتلعب بالبندقية بتاعتها في نادي الرماية
2103.0,2504764590_cf017c2a6e.jpg,رجل يقف على حافة بركة  مع اثنين من الكلاب ويرمي غصن في الماء,راجل واقف على حافة البسين مع اتنين كلاب وبيرمي غصن في الميه
2104.0,2504991916_dc61e59e49.jpg,امرأة تلف ذراعها حول رجل ويسيرون نحو شاحنة رقائق البطاطس,ست بتلف دراعها حوالين راجل وبيمشوا ناحية عربية البطاطس
2105.0,2505056124_1276e8dbcb.jpg,صبي يرفرف طائرة ورقية حمراء وبيضاء,ولاد بيطير طيارة ورق حمرا وبيضا
2106.0,2505360288_c972bd29c4.jpg,كلب يحاول التقاط فقاعات من آلة فقاعية في العشب,كلب بيحاول يمسك فقاعات من ماكينة الفقاعات في العشب
2107.0,2505465055_f1e6cf9b76.jpg,كلب أبيض يركض على العشب البني,كلب أبيض بيجري على العشب البني
2108.0,2505988632_9541f15583.jpg,فتاة ترتدي حذاء وردي تقفز فوق حبل وتبتسم,بنت لابسه جزمة وردي بتقفز فوق حبل وبتضحك
2109.0,2506892928_7e79bec613.jpg,ثلاثة أطفال في حقل ذو زهور بيضاء,تلات ولاد في حتة فيها ورد أبيض
2110.0,2507182524_7e83c6de82.jpg,كلب يطارد الكرة من خلال التراب,كلب بيجري ورا الكورة في التراب
2111.0,2507312812_768b53b023.jpg,كلب أسود وكلب رمادي يركض على الشاطئ,كلب أسود وكلب رمادي بيجرى على الشط
2112.0,2508249781_36e9282423.jpg,تجلس الفتاة التي ترتدي قبعة من القش على الدرجات الحجرية,بنت قعدة على السلم الحجري ولبسه قبعة قش
2113.0,2508313118_524e93d48c.jpg,كلب بني يطارد الصحن الطائر,كلب بني بيجري ورا الطبق الطائر
2114.0,2508918369_2659db1cb6.jpg,شاب يرتدي نظارات السباحة يقفز من فوق حمام السباحة,شاب لابس نظارات سباحة بيقفز من فوق حمام السباحة
2115.0,250892549_1e06a06a78.jpg, كلبان يحييان بعضهما البعض في العشب الأخضر,اتنين كلاب بيحيوا بعض في العشب الأخضر
2116.0,2509824208_247aca3ea3.jpg,كلب بني يركض على العشب,كلب بني بيجري على العشب
2117.0,2510020918_b2ca0fb2aa.jpg,ولد في أنبوب,ولاد في أنبوبة
2118.0,2510029990_7014f907cb.jpg,صبي صغير ينزلق أسفل الزحليقة وهو يضحك,ولاد صغير بينزل من الزحليقة وهو بيضحك
2119.0,2510197716_fddca0ac75.jpg,طفل على أرجوحة,طفل على الأرجوحة
2120.0,2510560080_1439fe32f2.jpg, طفلان يركبان خيولاً فوق الرمال بالقرب من سياج أبيض,اتنين ولاد راكبين خيول على الرمال قريب من سياج أبيض
2121.0,251056963_c8b67f0107.jpg,كلب أبيض وأسود يهرول على منحدر أزرق  و فمه مفتوح,كلب أبيض وأسود بيجري على منحدر أزرق وبوقه مفتوح
2122.0,2511019188_ca71775f2d.jpg,كلب مع الصحن الطائر أمام كلب أسمر,كلب مع الطبق الطائر قدام كلب أسمر
2123.0,2511762757_bd0ab0a017.jpg,كلب يقفز فوق حاجز ,كلب بيقفز فوق حاجز
2124.0,2512682478_b67cc525c7.jpg,صبي يدفع صبي آخر على الأرجوحة,ولاد بيوزع ولاد تاني على الأرجوحة
2125.0,2512683710_991c9d466d.jpg,مركب شراعي في الماء,مراكب شراعية في الميه
2126.0,2512876666_9da03f9589.jpg,رجل وكلب يقفان على جبل صخري أسود,راجل وكلب واقفين على جبل صخري أسود
2127.0,2513260012_03d33305cf.jpg,كلب أسود يركض خلف كلب أبيض في الثلج,كلب أسود بيجري ورا كلب أبيض في التلج
2128.0,2514581496_8f4102377e.jpg,كلب صغير أبيض في المطبخ يقفز أمام الطاولة,كلب صغير أبيض في المطبخ بيقفز قدام الترابيزة
2129.0,2514612680_b0d2d77099.jpg,رجل يسير بجانب جدار  مرسوماً عليه عبارة أين أنت؟ ,"راجل ماشي جنب حيطان مكتوب عليها ""فين أنت؟"""
2130.0,2515247156_c1b759fc33.jpg,صبي ينزلق لأسفل زحليقة الأطفال الزرقاء  مغلقا عينيه,ولاد بينزل من زحليقة للأطفال زرقا وعيونه مغمضة
2131.0,251586160_a31b187a37.jpg,كلب أسود ذو حزام أحمر يقفز,كلب أسود لابس حزام أحمر بيقفز
2132.0,2516317118_10ae66b87a.jpg,يقوم صبي صغير بوضع بعض الحروف على الحائط,ولاد صغير بيحط حروف على الحيط
2133.0,2517082705_93bc9f73ec.jpg,فتى يقف على مرج مظلل,ولاد واقف على مرج ظليل
2134.0,2517284816_9b8fd3c6b6.jpg,حشد من الأطفال,جمهور من الولاد
2135.0,251792066_b5233b3d86.jpg,كلب يصطاد لعبة في فمه,كلب ماسك لعبة في بوقه
2136.0,2518094853_dfce24ce8c.jpg,كلب بني يركض عبر حقل,كلب بني بيجري في الحقل
2137.0,2518219912_f47214aa16.jpg,فتاة صغيرة تحمل خرطوم الماء للكلب ليشرب منه,بنت صغيرة ماسكه خرطوم ميه للكلب عشان يشرب
2138.0,2518508760_68d8df7365.jpg,كلب يشارك في سباق بينما يرتدي الرقم ,كلب مشارك في سباق ولبس رقم 
2139.0,2518853257_02f30e282e.jpg,شخصين يجلسان على مقعد في الحديقة,اتنين قاعدين على كرسي في الحديقة
2140.0,2519483556_2b1632a18c.jpg,الفتيات الثلاث لديهن وسادات,تلات بنات معاهم مخدات
2141.0,251958970_fa6b423f23.jpg,رجل يحمل لافتة مع أشخاص يتجولون في الخلفية,راجل شايل لافته وناس ماشيين وراه
2142.0,2519594430_551225e5bd.jpg,الكلب الأسود يحمل لعبة على العشب,كلب أسود شايل لعبة على العشب
2143.0,2519812011_f85c3b5cb5.jpg,زوجان يمران عبر نافورة كبيرة على الرصيف,اتنين ماشيين جنب نافورة كبيرة على الرصيف
2144.0,2520255786_b70a3ec032.jpg,طفل يقفز من الأرجوحة وهو في الجو,طفل بيقفز من الأرجوحة وهو في الهوا
2145.0,2520909293_9bb7f7364e.jpg,رجل في قميص أصفر مع دراجة يحلق عالياً في الهواء,راجل لابس قميص أصفر مع دراجة بيطير في الهوا
2146.0,2521062020_f8b983e4b2.jpg,رجل وصبي يستعدان ليصعدان حائط التسلق,راجل وولاد مستعدين يصعدوا حيطان التسلق
2147.0,2521213787_ca9b5a1758.jpg,تسير سيارة زرقاء أسفل طريق ترابي ,عربية زرقا ماشية في طريق ترابي
2148.0,252124738_796599e94b.jpg,زوجان يجلسان معا بينما يأكل الرجل الذرة,اتنين قاعدين مع بعض والراجل بياكل ذرة
2149.0,2521770311_3086ca90de.jpg,صبي يحمل صورة فوق رأسه,"ولاد شايل صورة فوق راسه
"
2150.0,2521878609_146143708e.jpg,شخص يأكل المعكرونة,واحد بياكل مكرونة
2151.0,2521938720_911ac092f7.jpg,رجل يرقد على الأرض ويضحك أثناء لعبة كرة المضرب,واحد نايم على الأرض وبيضحك في مباراة تنس
2152.0,2521938802_853224f378.jpg,يتأرجح مضرب لاعب كرة المضرب ,المضرب بتاع لاعب التنس بيتحرك
2153.0,2521983429_33218366bd.jpg,كلب ومالكه في شاطئ صخري,كلب وصاحبه على شاطئ رملي
2154.0,2522230304_1581d52961.jpg,رجل يصعد صخرة,واحد طالع صخرة
2155.0,2522297487_57edf117f7.jpg,سيدة تحمل ولدًا صغيرًا بينما يبتسم طفل صغير آخر لهم,واحدة شايلة ولد صغير وطفل صغير تاني بيبتسملهم
2156.0,2522467011_cc825d89ac.jpg,فتاة في ثوب أحمر وأبيض تلعب بأطواق الخصر,بنت لبسة فستان أحمر وأبيض بتلعب بحزام
2157.0,2522540026_6ee8ab4c6a.jpg,تتحرك سيارة سباق على الطريق بينما يشاهد شخصان من بعيد,عربية سباق ماشية على الطريق واثنين بيتفرجوا من بعيد
2158.0,2522809984_2e8a7df4fb.jpg,كلب أسود يسبح في الماء,كلب أسود بيعوم في الميه
2159.0,2524003134_580e74328b.jpg,كلب في الماء,كلب في الميه
2160.0,2524084967_a5e011b73d.jpg,رجل يقوم بخدعة دراجة هوائية في الجو,واحد بيعمل حركة بدراجته في الهوا
2161.0,252504549_135b0db5a3.jpg,كلب على الشاطئ لديه كرة في فمه,كلب على الشاطئ ماسك كرة في بوقه
2162.0,2525232298_cf42d415ab.jpg,رجل يصعد حجارة كبيرة,واحد طالع على صخور كبيرة
2163.0,2525270674_4ab536e7ec.jpg,كلب أبيض وبني يقفز من أجل الصحن الطائر الأبيض,كلب أبيض وبني بيقفز عشان يمسك طبق طائر أبيض
2164.0,2525455265_f84ba72bd7.jpg,فتاة تجلس على مقعد بين العشب,بنت قاعدة على كرسي في العشب
2165.0,2525666287_638ab5e784.jpg,رجل وامرأة ينتظران قطارًا متجاهلين بعضهما البعض,واحد وست بتستنا قطار وبيطنشوا بعض
2166.0,2525716531_e6dedee421.jpg,رجل يدرب كلب للهجوم,واحد بيدرب كلب على الهجوم
2167.0,252578659_9e404b6430.jpg,مجموعة صغيرة من الماعز في العشب مع كلب أبيض وأسود في الخلفية,مجموعة صغيرة من الغنم في العشب وكلب أبيض وأسود في الخلفية
2168.0,2526041608_a9775ab8d7.jpg,لاعب كرة قدم يرتدي قميصًا أصفر اللون يدفع  لاعبًا آخر بعيدًا,لاعب كرة قدم لابس قميص أصفر بيدفع لاعب تاني بعيد
2169.0,2526585002_10987a63f3.jpg,مجموعة من الرجال في قارب أصفر مع كلابهم,مجموعة من الرجالة في قارب أصفر مع كلابهم
2170.0,2527163162_d0fb802992.jpg,طفل يحمل قضيبًا بينما يقف على جسر بالقرب من منطقة عشبية,طفل ماسك عصاية وواقف على كوبري جنب منطقة عشبية
2171.0,2527303359_6c3dc3f282.jpg,فتاة في ثوب أبيض على الشاطئ,بنت لبسة فستان أبيض على الشاطئ
2172.0,2527713011_b0ec25aa54.jpg,سيارة سباق عالمية,عربية سباق عالمية
2173.0,252802010_3d47bee500.jpg,كلبين يلعبان,اتنين كلاب بيلعبوا
2174.0,252846811_7b250935a7.jpg, اثنين من الكلاب يلعبان,اتنين كلاب بيلعبوا
2175.0,2528489543_546c1ca81f.jpg,صبي يقف في حمام السباحة أسفل زحليقة مائية زرقاء,ولد واقف في حمام السباحة تحت زحليقة مائية زرقاء
2176.0,2528521798_fb689eba8d.jpg,سباق سيارات بيضاء في الأوساخ والماء,عربية سباق بيضاء بتجري في التراب والميه
2177.0,2528547068_7d37479b9b.jpg,سيارة سباق مقادة ضمن مضمار سباق مغطى بالأوساخ,عربية سباق بتجري في مضمار سباق مغطى بالتراب
2178.0,2528552898_9e49a7033f.jpg,سيارة صفراء تقترب من الماء,عربية صفراء قرب الميه
2179.0,2529116152_4331dabf50.jpg,يقف رجل ذو بشرة داكنة على كف واحد أمام مبنى أصفر,واحد لونه اسمر واقف على رجل واحدة قدام مبنى أصفر
2180.0,2529205842_bdcb49d65b.jpg,اثنين من لاعبي كرة السلة يتدافعون للحصول على الكرة في الملعب,اتنين لاعبين كرة سلة بيتخانقوا عشان يمسكوا الكورة في الملعب
2181.0,2531531628_b4a5041680.jpg,فتاة صغيرة تخرج لسانها,بنت صغيرة بتخرج لسانها
2182.0,2531837969_6f28637811.jpg,رجل يقف على جرف يطل على المحيط,واحد واقف على حافة جبل وبيشوف البحر
2183.0,2531942624_c3c072064e.jpg,صبي يركض عبر الرمال,ولد بيجري في الرمال
2184.0,2532262109_87429a2cae.jpg,يقف مجموعة من الناس خارجا بينما يأخذ المرء صورة,مجموعة من الناس واقفين برة وواحد بيصور
2185.0,2532294586_4cd76a837d.jpg,فتاة صغيرة ترتدي اللون الوردي تتأرجح على أرجوحة,بنت صغيرة لبسة وردي بتتأرجح على أرجوحة
2186.0,2533010184_ef2fd71297.jpg,امرأة ترتدي حجابا تقف بجانب حديقة من الزهور البيضاء,واحدة لبسة طرحة واقفة جنب حديقة فيها ورد أبيض
2187.0,2533076864_d799996433.jpg,امرأة مسنة تجمع القمامة القابلة لإعادة التدوير,ست عجوزة بتجمع الزبالة اللي بتتلفظ
2188.0,2533414541_362bf043bb.jpg,سيارة بيضاء وزرقاء في الشارع,عربية بيضاء وزرقاء في الشارع
2189.0,2533424347_cf2f84872b.jpg,سيارة سباق تهب الدخان أثناء القيادة,عربية سباق بتطلع دخان وهي ماشية
2190.0,2533642917_a5eace85e6.jpg,صبي في ثوب السباحة يقف في الماء,ولد لابس مايو واقف في الميه
2191.0,2534194182_ac53035cf4.jpg,مجموعة من أعضاء الفرقة يقومون بعمل روتيني,مجموعة من أعضاء فرقة بيعملوا روتين
2192.0,2534424894_ccd091fcb5.jpg,فتاة تركض عبر الرمال غير المستوية مع بعض العشب ذابل,بنت بتجري في الرمال اللي مش مستوية مع شوية عشب ناشف
2193.0,2534502836_7a75305655.jpg,كلب صغير باللونين البني والأبيض يركض عبر العشب الطويل,كلب صغير لونه بني وأبيض بيجري في العشب الطويل
2194.0,2534652796_c8a23288ab.jpg,صبي صغير وفتاة ترتد على الكرات الحمراء والزرقاء في الفناء على العشب,ولد صغير وبنت بيقفزوا على كرات حمراء وزرقاء في الفناء على العشب
2195.0,2535746605_8124bf4e4f.jpg,فتاة صغيرة ترتدي قميصًا أحمر وتنورة بيضاء تركض عبر العشب,بنت صغيرة لبسة قميص أحمر وتنورة بيضاء بتجري في العشب
2196.0,2537119659_fa01dd5de5.jpg,فتاة تقود سيارة لعبة بينما يلعب طفل صغير خلفها,بنت بتسوق عربية لعبة وطفل صغير بيلعب وراها
2197.0,2537197415_af7c30dfc8.jpg, الطفل في حمام سباحة للأطفال يرش الماء بينما يلعب الأطفال الآخرون في الخلفية,طفل في حمام سباحة للأطفال بيرش ميه وعيال تانيين بيلعبوا في الخلفية
2198.0,2537583012_4a358a6a8a.jpg,يتدحرج رجلان على الرصيف,اتنين رجالة بيتدحرجوا على الرصيف
2199.0,253762507_9c3356c2f6.jpg,يقف عامل مترو أنفاق بجوار سيارة بها عدة أكياس للقمامة بداخلها,"عامل مترو واقف جنب عربية فيها شوالات زبالة كتير 
"
2200.0,2538423833_d1f492d1fb.jpg,طفل صغير وكلب أبيض صغير,طفل صغير ولبس أبيض صغير
2201.0,2538477523_1da77eb11c.jpg,رجل وفتاة صغيرة يركضون في ممشى,راجل وبنت صغيرة بيجرّوا في المشي
2202.0,2539933563_17ff0758c7.jpg,شخص يقف على الرصيف بالقرب من تجمع كبير من الناس في خيمة,واحد واقف على الرصيف جنب مجموعة كبيرة من الناس في خيمة
2203.0,2540203582_9a9ac92a5d.jpg,فتاة تركب دراجة بخارية على رصيف,بنت راكبة دراجة بخارية على الرصيف
2204.0,2540326842_bb26cec999.jpg,مجموعة من الأطفال ينظرون من السياج,مجموعة من الولاد بيبصّوا من السور
2205.0,2540360421_f7c2401da8.jpg,رجل بدون قميص يتسلق جدارا صخريا بمساعدة حبل أحمر,راجل من غير قميص بيتسلق حيط صخري بمساعدة حبل أحمر
2206.0,2540750172_070250ece5.jpg,يتمتع الناس بالوقت على متن القارب,الناس مستمتعين بالوقت على المركب
2207.0,2540751930_d71c7f5622.jpg,يسير المشاة على رصيف المشاة بجوار حقل عشبي مشجر,الناس ماشيين على رصيف المشاة جنب حقل عشبي مشجر
2208.0,2540757246_5a849fbdcb.jpg,مجموعة من الناس يقفون خارج المنزل ليلا,مجموعة من الناس واقفين برّه البيت بليل
2209.0,2540884723_03d60ef548.jpg,رجل وامرأة يجلسان على سلالم خرسانية,راجل ومرأة قاعدين على سلم خرسانة
2210.0,2541104331_a2d65cfa54.jpg,كلب بني يرش الماء,كلب بني بيرشّ الماء
2211.0,2541701582_0a651c380f.jpg,رجل وامرأة ريقودون الدراجات على الممر,راجل ومرأة بيجرّوا الدراجات على الممر
2212.0,2541901399_0a57f4cc76.jpg,طفل صغير في قميص أخضر وأصفر يتبعه امرأة على كرسي متحرك في سترة حمراء أمام مقعد خشبي,طفل صغير لبس أخضر وأصفر وراه ستّه على كرسي متحرك لابسة جاكيت أحمر قدام مقعد خشبي
2213.0,2542037086_58c833699c.jpg,طفل على زحليقة حمراء,طفل على زحلقة حمراء
2214.0,2542415282_9240e1b5fc.jpg,الفتيات يلعبن في ملعب الرمال,البنات بيلعبوا في ملعب الرمل
2215.0,2542662402_d781dd7f7c.jpg,امرأة في قميص أزرق ترشد كلبها ليقفز حاجز,ستّه لابسة قميص أزرق بتوجّه كلبها يقفز حاجز
2216.0,254295381_d98fa049f4.jpg,كلب أسود وبني يقف على السطح,كلب أسود وبني واقف على السطح
2217.0,2543017787_9720b4fa1c.jpg,طفل يركب أرجوحة,طفل راكب أرجوحة
2218.0,2543247940_083f1b7969.jpg,كلب أبيض كبير يلعب بعصا كبيرة,كلب أبيض كبير بيلعب بعصا كبيرة
2219.0,2543589122_ec3e55f434.jpg,يلعب الكلب البيج والبني الداكن في حمام السباحة وفمه مفتوح,كلب بيج وبني غامق بيلعب في حمام السباحة وفمه مفتوح
