image_number,image,text,egyptian
6061.0,3522000960_47415c3890.jpg,رجل يركت موجة على لوح التزلج الخاص به,راجل بيركب موجة على لوح التزلج بتاعه
6062.0,3522025527_c10e6ebd26.jpg,طائرة هليكوبتر وطائرة صغيرة في الهواء,هليكوبتر وطيارة صغيرة في الهوا
6063.0,3522076584_7c603d2ac5.jpg,راكب الدراجة النارية يقوم بخدعة في الهواء,راكب الموتوسيكل بيعمل حركه في الهوا
6064.0,3522349685_f046f0e250.jpg,طفل يداعب كلب,طفل بيلعب مع كلب
6065.0,3522749949_fb615cee47.jpg,رجل في ملعب لكرة القدم  في زي  على وشك ركلة كرة القدم,راجل في ملعب كورة في زي على وشك يركل الكورة
6066.0,3522989916_f20319cc59.jpg,كلب باللون البني وكلب رمادي يلعب في العشب,كلب بني وكلب رمادي بيلعبوا في العشب
6067.0,3523471597_87e0bf3b21.jpg,زوجان ينظران إلى خريطة المنطقة,زوجين بيبصوا على خريطة المنطقة
6068.0,3523474077_16e14bc54c.jpg,رجل يحمل كاميرا رقمية واقفة خارج مبنى ضخم,راجل شايل كاميرا ديجيتال واقف برة مبنى ضخم
6069.0,3523559027_a65619a34b.jpg,كثير من الناس في تشكيل على الميدان,ناس كتير في تشكيل على الملعب
6070.0,3523819210_99782628fc.jpg,رجل يجلس على كرسي معدني أزرق,راجل قاعد على كرسي معدني أزرق
6071.0,352382023_7605223d1c.jpg,كلب يحمل عصا أثناء المشي في الماء,كلب شايل عصاية وهو ماشي في المايه
6072.0,3523874798_9ba2fa46e3.jpg,صبي في قميص أبيض وخوذة خضراء يركب لوح التزلج أسفل بعض الخطوات,ولد لبس قميص ابيض وخوذة خضرا بيركب لوح التزلج من على بعض الدرجات
6073.0,3523920786_0eb63993fd.jpg,كلب أسود يركض في طريق  في وسط حقل,كلب أسود بيجري في طريق في وسط الحقل
6074.0,3523950181_414978964e.jpg,حارس المرمى هو الذي يغطي شبكته في حين يطارد لاعبين آخرين كرة الهوكي,حارس المرمى هو اللي بيغطي الشبكة بتاعته بينما لاعيبة تانية بتجري ورا الكورة
6075.0,3523972229_d44e9ff6d7.jpg,المتزلج يطير في الهواء,متزلج بيطير في الهوا
6076.0,3524436870_7670df68e8.jpg,كلب بني يلعب بالفقاعات,كلب بني بيلعب بالفشار
6077.0,3524519277_bd0c3e7382.jpg,رجل يتحدث إلى اثنين من الحراس وهو يحمل شرابًا,راجل بيتكلم مع اثنين من الحراس وهو شايل شراب
6078.0,3524612244_64f00afec5.jpg,امرأة تصب النبيذ وتراقب التلفزيون,ست بتصب نبيذ وبتتفرج على التليفزيون
6079.0,3524914023_4e96edb09f.jpg,لاعب بيسبول يحمل مضربه ويستعد للعبة,لاعب بيسبول شايل مضربه وبيستعد للعبة
6080.0,3524975665_7bec41578b.jpg,امرأة في معطف أصفر يقف على الرصيف,ست لبسة معطف أصفر واقفة على الرصيف
6081.0,3525403875_7f95e0cbfe.jpg,كلب أبيض واحد يركض مع كرة التنس في فمه بينما يهرول كلب آخر على طول,كلب ابيض واحد بيجري مع كرة التنس في بقه بينما كلب تاني بيجري جنبه
6082.0,3525417522_7beb617f8b.jpg,يمر كلب بني صغير عبر العشب أمام كلب آخر وأصحابه,كلب بني صغير بيعدي من على العشب قدام كلب تاني وصاحبه
6083.0,3525453732_f74a38f111.jpg,طائر يطير منخفضًا مع انتشار أجنحته,عصفور بيطير منخفض مع انتشار جناحيه
6084.0,3525841965_7814484515.jpg,اثنين من الأطفال الصغار يقفون في الخارج على طريق ترابي,اتنين من الأطفال الصغيرين واقفين برة على طريق ترابي
6085.0,3526018344_450c517a72.jpg,مجموعة من الكلاب تلعب,مجموعة من الكلاب بتلعب
6086.0,3526150930_580908dab6.jpg,امرأة وفتاة تشكلان وتبتسمان لالتقاط صورة,ست وبنت بيعملوا بوز وبيبتسموا عشان يصوروا
6087.0,3526431764_056d2c61dc.jpg,امرأة تلتقط صورة تقف بجانب رجل طويل القامة وأمام رجل آخر يلتقط صورة أيضًا,ست بتصور واقفة جنب راجل طويل و قدام راجل تاني بيصور كمان
6088.0,3526805681_38461c0d5d.jpg,رجل يحمل علامة مع كلب على مقود,راجل شايل لافته مع كلب مربوط في سلسلة
6089.0,3526897578_3cf77da99b.jpg,كلب أسود يحمل دلو أحمر في فمه,كلب أسود شايل دلو أحمر في بقه
6090.0,3527184455_1a9c074ff2.jpg,رجل وامرأة وصبيان يجلسان على مقعد مع الزهور في الخلفية,راجل وست واتنين ولاد قاعدين على كرسي مع زهور في الخلفية
6091.0,3527261343_efa07ea596.jpg,رجل يفعل خدعة الساق مفتوحة أثناء القيام بالدراجة النارية على دراجته,راجل بيعمل حركه الساق مفتوحة وهو بيمشي على الموتوسيكل
6092.0,3527524436_a54aca78a9.jpg,رجل في تيارات مائية  في بحيرة محاطة بالثلوج,راجل في تيارات مائية في بحيرة محاطة بالثلج
6093.0,3527590601_38d56abc29.jpg,صبي على دراجة يقفز فوق بعض التلال الرملية,ولد على دراجة بيقفز فوق بعض التلال الرملية
6094.0,3527682660_c5e9fa644a.jpg,مجموعة من الناس يجلسون حول مكتب,مجموعة من الناس قاعدين حوالين مكتب
6095.0,3527715826_ea5b4e8de4.jpg,فتاة في زحافات وردي وسراويل لعب التنس,بنت في زحليقة وردي وبنطلون لعب تنس
6096.0,3527926597_45af299eee.jpg,صبي على لوح التزلج يركب على منحدر,ولد على لوح التزلج بيركب على منحدر
6097.0,3528105511_12ff45dc9c.jpg,شخص على دراجة ترابية في الهواء,شخص على دراجة ترابية في الهوا
6098.0,3528251308_481a28283a.jpg,رجل يركب لوح تزلج يقفز على حافة الخشب,راجل بيركب لوح تزلج بيقفز على حافة الخشب
6099.0,3528902357_be2357a906.jpg,يحاول سائق الدراجة خدعة بينما يرتدي الحد الأدنى من معدات الحماية,"سائق الدراجة بيحاول يعمل حركه وهو لبس أقل حاجات الحماية 
"
6100.0,3528966521_2e871ff6a1.jpg,عدائي الماراثون على الطريق أمام سلسلة الجبال,ماراثون عدّي على الطريق قدام سلسلة الجبال
6101.0,3529211822_1dabdb3a9c.jpg,كلب بني يشرب الماء من وعاء بينما يقفز كلب أسود إلى جواره,كلب بني بيشرب مايه من بولة و كلب أسود بيقفز جنبه
6102.0,3529314899_b4e533bb76.jpg,لاعب الهوكي في الأبيض يحاول سرقة العفريت من لاعب آخر باللون الأحمر,لاعب هوكي اللي لابس أبيض بيحاول يسرق البقعة من لاعب تاني لابس أحمر
6103.0,3529721084_4b405baf54.jpg,اثنين من سائقي الدراجات النارية  أحدهما بقناع  يظهران في الشارع بدراجتهما,اتنين راكبين موتوسيكل واحد فيهم لابس ماسك بيظهروا في الشارع
6104.0,352981175_16ff5c07e4.jpg,المتزحلق يساعد زميله المتزحلق ينهض من الثلج,المتزلج بيساعد زميله المتزلج يقوم من على الثلج
6105.0,3530087422_7eb2b2c289.jpg,شخص يرتدي بدلة حمراء وبيضاء يركع على لوح التزلج ويهرب على الطريق,واحد لابس بدلة حمرا و بيضا راكب سكيتبور و بيجري في الشارع
6106.0,3530342993_a4a1f0e516.jpg,دراجة تقفز في الهواء,دراجة بتقفز في الهوا
6107.0,3530502404_f8c3a3f61c.jpg,رجل يلبس قناعًا وجلدًا أسود يجلس على دراجة نارية في الشارع,واحد لابس ماسك و جلد أسود قاعد على موتوسيكل في الشارع
6108.0,3530504007_3272c57e21.jpg,يقف ثلاثة رجال في حشد يتكلم,تلات رجالة واقفين في زحمة و بيتكلموا
6109.0,3530687486_6e6be53602.jpg,امرأة تنفخ على الهندباء,ست بتنفخ على الهندباء
6110.0,3530843182_35af2c821c.jpg,يمارس الزوجان طرقًا مختلفة لارتداء نظارة شمسية أمام سيارة حمراء,اتنين متجوزين بيجربوا طرق مختلفة للبس النظارة الشمسية قدام عربية حمرا
6111.0,353180303_6a24179c50.jpg,امرأة ترتدي الملابس تضع ماكياج أثناء النظر في مرآة,ست بتلبس و بتحط ميكب و بتبص في المرايا
6112.0,3531811969_49af4c22f0.jpg,يقوم سائق الدراجة بخدعة,راكب الدراجة بيعمل حركة
6113.0,3532028205_9ddd7599f8.jpg,لاعب هوكي يجلس قليلا  مع حشد كامل في الخلفية,لاعب هوكي قاعد و في زحمة ورا
6114.0,3532098999_4e07a0a17e.jpg,الكلاب تتمتع بمطاردة بعضهم البعض في الحديقة,الكلاب بتلعب ببعضها في الحديقة
6115.0,3532192208_64b069d05d.jpg,رجل في غرفة مع ثلاثة أشخاص آخرين يحملون كاميرا كبيرة,واحد في اوضة مع تلاتة تانيين و ماسك كاميرا كبيرة
6116.0,3532194771_07faf20d76.jpg,رجل يتجه لرؤية مع لوح ركوب الأمواج في يده,واحد ماشي على البحر و ماسك لوح ركوب الأمواج
6117.0,3532200762_b28c39d311.jpg,فتاة تركض على الشاطئ,بنت بتجري على الشاطئ
6118.0,3532205154_5674b628ea.jpg,رجل يفحص القلادة الجميلة التي ترتديها المرأة,واحد بيبص على القلادة الحلوة اللي ست لابساها
6119.0,3532412342_e0a004b404.jpg,طفل يدور في إطار كبير,طفل بيلف حوالين اطار كبير
6120.0,3532539748_795d16ef07.jpg,رجل وطفلة يقفان في الفناء بجانب مقعد,واحد و بنت واقفين في الجنينة جنب كرسي
6121.0,3532587748_7e64bb223a.jpg,صبي يقف من جهة على الرصيف,ولد واقف لوحده على الرصيف
6122.0,3532593368_be10432e92.jpg,مجموعة كبيرة من الناس يمدون أيديهم في الهواء دفعة واحدة,مجموعة كبيرة من الناس بيمدوا ايديهم في الهوا مرة واحدة
6123.0,3532761259_14026c1e96.jpg,امرأة وامرأة شابة تضعان أذرعهما حول بعضهما البعض,ست و بنت حاطين ايديهم على بعض
6124.0,3532782283_341f0381a3.jpg,ثلاثة أشخاص يواجهون الجبال,تلاتة ناس بيبصوا على الجبال
6125.0,3533145793_5d69f72e41.jpg,تقوم مجموعة من الأطفال بالتمدد على الحصائر الملونة,مجموعة من الولاد بيمدوا على سجاد ملون
6126.0,3533394378_1513ec90db.jpg,يتم ربط رجل وامرأة في جولة معدنية دائرية,واحد و ست مربوطين في دورة معدنية
6127.0,3533451027_b078e4631b.jpg,رجل أسود وأبيض يمسك كرة بشريط أحمر وأزرق,واحد أسود و واحد أبيض ماسكين كرة عليها شريط أحمر و أزرق
6128.0,3533470072_87a5b595ba.jpg,فتاتان يعطيان علامة السلام,بنتين بيعملوا علامة السلام
6129.0,3533484468_0787830d49.jpg,رجل يقف إلى جوار امرأة وهو يحمل جهازًا إلكترونيًا في أذنه,واحد واقف جنب ست و ماسك جهاز في ودن
6130.0,3533660418_f3a73a257c.jpg,ثلاثة رجال يجلسون تحت المظلة,تلاتة رجالة قاعدين تحت المظلة
6131.0,3533775651_9d7e93dacf.jpg,شخص باللون الأحمر يفتح باب سيارة حمراء في منطقة وقوف السيارات,واحد لابس أحمر بيفتح باب عربية حمرا في مواقف السيارات
6132.0,3533922605_a2b1e276f6.jpg,فتاتان يجلسان على أرضية خشبية أمام نافذة كبيرة,بنتين قاعدين على الأرض الخشب قدام شباك كبير
6133.0,3534046564_4f8546e364.jpg,كلبان يقتربان من بعضهما البعض في العشب,اتنين كلاب بيقربوا من بعض في العشب
6134.0,3534183988_3763593dfb.jpg,رجل يلبس كقرصان يبتسم للكاميرا بين ذكر وأنثى,واحد لابس زي قرصان بيضحك للكاميرا بين راجل و ست
6135.0,3534512991_f9fd66f165.jpg,رجل وامرأة أمام الزهور الصفراء,واحد و ست قدام ورد أصفر
6136.0,3534548254_7bee952a0e.jpg,فتاة في قميص أصفر ترمي كرة قدم مبللة,بنت لابسة قميص أصفر بتلقي كرة قدم مبلولة
6137.0,3534668485_6887629ff0.jpg,تقف امرأة بيضاء ومرأة سوداء تتحدثان على الهاتف المحمول,ست بيضا و ست سودا واقفين بيتكلموا في الموبايل
6138.0,3534824784_7133119316.jpg,فتاة تتكئ على كتف امرأة أثناء الجلوس على مقعد,بنت بتتكئ على كتف ست و قاعدين على كرسي
6139.0,3534952095_975cca0056.jpg,سيدة تركب دراجة نارية صغيرة,ست بتسوق موتوسيكل صغير
6140.0,3535056297_e16f014cb7.jpg,مجموعة من الناس اغلبية رجال يشاهدون شيئا,مجموعة من الناس أغلبهم رجالة بيشوفوا حاجة
6141.0,3535084928_858544f49a.jpg,الكلاب البنيّة تلعق أنفها الأسود,كلاب بنية بتلحس أنفها السودا
6142.0,3535284878_f90f10236e.jpg,كلب أبيض يركض على شاطئ صخري,كلب أبيض بيجري على شاطئ صخري
6143.0,3535304540_0247e8cf8c.jpg,تركت طائرة حمراء دخانًا أبيض خلفها,طيارة حمرا سابت دخان أبيض وراها
6144.0,3535372414_4c51c86fc4.jpg,امرأة مسنة وفتاة صغيرة تقف أمام شجيرة كبيرة مغطاة بالورود الوردية,ست عجوزة و بنت صغيرة واقفين قدام شجرة كبيرة مليانة ورد وردي
6145.0,3535664885_c848c0faee.jpg,هوكي حارس المرمى يحاول منع تسديدة من برايان نوجنت,حارس مرمى هوكي بيحاول يمنع ضربة من برايان نوجنت
6146.0,3535768334_a3924bcccd.jpg,صبي على دراجته يرتدي قميصًا أزرقًا وهو في الجو,ولد على دراجته لابس قميص أزرق و هو في الهوا
6147.0,3535879138_9281dc83d5.jpg,حشد من الناس يلوحون بالأعلام الحمراء يمرون تحت جسر,حشد من الناس يلوحون بالأعلام الحمراء يمرون تحت جسر
6148.0,3536561454_e75993d903.jpg,رجل يرتدي خوذة سوداء وبنطلون أسود وقميص يركب لوحه في حديقة,واحد لابس خوذة سودا و بنطلون أسود و قميص بيسوق لوح في حديقة
6149.0,3537201804_ce07aff237.jpg,طفل يدور على دوامة," طفل بيلف على دوارة 
"
6150.0,3537218226_478d2e4f26.jpg,شخص يتسلق الصخور ورجل آخر على الأرض يحمل الحبل,واحد بيطلع على الصخور وواحد تاني واقف على الأرض ماسك الحبل
6151.0,3537400880_8f410d747d.jpg,فتاة تقوم بإنشقاقات في الهواء بينما تقفز على الترامبولين,بنت بتعمل انشقاقات في الهوا وهي بتقفز على الترامبولين
6152.0,3537452619_3bd79f24e0.jpg,يوازن صبي يرتدي بنطال جينز وأحذية حمراء اللون على شريط أحمر,ولد لابس بنطلون جينز و أحذية حمرا بيعمل توازن على شريط أحمر
6153.0,3537474810_cf676b3259.jpg,رجل يرتدي زيا أزرق اللون يركل كرة القدم في الملعب,راجل لابس لبس أزرق بيركل كرة القدم في الملعب
6154.0,3537520829_aab733e16c.jpg,شخص يرتدي قميصًا أبيض اللون يقوم بطحن لوح التزلج أسفل قضيب طويل في حديقة تزلج,واحد لابس قميص أبيض بيطحن لوح التزلج تحت قضيب طويل في حديقة التزلج
6155.0,3537806062_c50d814aba.jpg,الكلبان يركضان على العشب,كلبين بيجريوا على العشب
6156.0,3537920947_6c5a956f47.jpg,متزلج صبي على مقعد خشبي,ولد متزلج على كرسي خشبي
6157.0,3538021517_b930dc76fc.jpg,صورة مقربة لصبيين يلعبان كرة القدم في زي فريقهما,صورة قريبة لولادين بيلعبوا كرة القدم بلبس فريقهم
6158.0,3538213870_9856a76b2a.jpg,فتاة تدور في ثوب وردي,بنت بتلف في فستان وردي
6159.0,3538527033_df13112d51.jpg,هناك ثلاث نساء يرتدين الفساتين والعصابات المختلفة يرقصن في الشارع,فيه ثلاث ستات لابسين فساتين و عصابات مختلفة بيرقصوا في الشارع
6160.0,3538686658_30afc75f02.jpg,راكب الدراجة النارية يتسابق إلى أسفل,راكب دراجة نارية بينزل بسرعة
6161.0,3539767254_c598b8e6c7.jpg,يتم توجيه جندول عبر القنوات مع قوارب أخرى حولها,جندول بيتحرك في القنوات مع قوارب تانية حواليه
6162.0,3539817989_5353062a39.jpg,رجل يركع على الأرض محاطة بعدة قطط,راجل راكب على الأرض محاط بكتاكيت كتير
6163.0,3539840291_1c3eed701d.jpg,لاعب يصطدم بخصمه في لعبة الركبي,لاعب بيصدم خصمه في لعبة الركبي
6164.0,3540155303_08225a4567.jpg,رجل يطير في الهواء على دراجته في حديقة لوح التزلج,راجل بيطير في الهوا على دراجته في حديقة لوح التزلج
6165.0,3540241710_a4f49cde52.jpg,رجل تزلج في مستودع,راجل بيتزلج في مخزن
6166.0,3540416139_c884f38351.jpg,كلب يطارد لعبة في العشب مع صاحبها في الخلفية,كلب بيطارد لعبة في العشب و صاحبه في الخلفية
6167.0,3540416981_4e74f08cbb.jpg,كلب يطارد حيوان محشي معلق على خيط,كلب بيطارد لعبة محشية معلقة بخيط
6168.0,3540515072_8c951b738b.jpg,كلب أسود يقفز,كلب أسود بيقفز
6169.0,3540598210_972f0ff573.jpg,فتاة في ثوب زهرة القرنفل,بنت لابسة فستان زهري
6170.0,3541141771_67d305c873.jpg,صبيان  أحدهما يتسلق السقف  والآخر ينحني وينظر إلى الأرض,ولاد واحد بيطلع على السقف والتاني باينحني وبيبص على الأرض
6171.0,3541162969_68fa4a60df.jpg,سيدة في ملابس السباحة الزرقاء تسبح تحت الماء,ست في لبس سباحة أزرق بتسبح تحت المية
6172.0,3541474181_489f19fae7.jpg,رجل يتزلج,راجل بيتزلج
6173.0,3541483943_9776baee7c.jpg,رجل يقوم بعمل خدعة على لوح تزلج في حديقة تزلج  ,راجل بيعمل حيلة على لوح التزلج في حديقة التزلج
6174.0,3541491057_61a49588d9.jpg,اثنين من الكلاب يلعبون في حقل عشبي,كلبين بيلعبوا في حقل عشبي
6175.0,3541915243_956c1aa8ef.jpg,تجمع حشد من الناس معا يبحثون ويلتقطون الصور,ناس كتير متجمعين مع بعض بيدوروا وبيصوروا
6176.0,3541962817_78bcd3835b.jpg,يتحرك حصان فوق السياج بينما يركب الفارس,حصان بيمشي فوق السور و الفارس راكب عليه
6177.0,3542341321_faa2d2d48a.jpg,اثنين من الكلاب السوداء تواجه بعضها البعض تظهر أسنانهم,كلبين سود بيقابلوا بعض وبيخرجوا سنونهم
6178.0,3542418447_7c337360d6.jpg,كلب أسود وكلب بني مع لعبة كرة القدم الصفراء على حقل عشبي,كلب أسود و كلب بني مع لعبة كرة قدم صفرا في حقل عشبي
6179.0,3542425197_2ef81c6051.jpg,يميل رجل مع غيتار كهربائي وشعر طويل نحو موسيقي آخر,راجل معاه جيتار كهربائي وشعره طويل بيميل ناحية موسيقي تاني
6180.0,3542484764_77d8920ec9.jpg,رجل يرتدي ملابس بيضاء يلعب الرياضة,راجل لابس لبس أبيض بيلعب رياضة
6181.0,3542771548_fcb8fa0cba.jpg,حصان وراكب يقفزان سياجًا صغيرًا,حصان و راكب بيقفزوا سور صغير
6182.0,3543294190_0037c59607.jpg,رجل يوضح كيف يركب دراجة مع عجلة خلفية فقط على الأرض,راجل بيشرح ازاي يركب دراجة بعجلة وحدة في الخلف على الأرض
6183.0,3543378438_47e2712486.jpg,رجل يرتدي سترة خضراء يلعب البيانو بينما تغني امرأة,راجل لابس جاكيت أخضر بيلعب بيانو و ست بتغني
6184.0,3543600125_223747ef4c.jpg,سيدة تضحك وهي تشرب القهوة,ست بتضحك وهي بتشرب قهوة
6185.0,3544233095_4bca71df1d.jpg,طفل بمفرده على شاطئ يحمل دلو,طفل لوحده على الشاطئ ماسك دلو
6186.0,3544312930_3a0b8d70c1.jpg,امرأة تحمل محفظة وسترة وردية تقف,ست ماسكة شنطة و جاكيت وردي واقفة
6187.0,3544483327_830349e7bc.jpg,رجل في كل الأسود يستخدم دراجة خضراء لخداع لافتة تقول عشاء مجاني,راجل كله أسود بيستخدم دراجة خضرا علشان يعمل حيلة لافتة بتقول عشاء مجاني
6188.0,3544573946_e03aebbfde.jpg,فتاة ترتدي ملابس حمراء وزرقاء تاخذ وضعية و رجلاً راكعاً لالتقاط صورتها,بنت لابسة لبس أحمر و أزرق بتاخد وضعية و راجل راكب عشان يصورها
6189.0,3544669026_1b5c0e6316.jpg,كلب أسود يقفز للقبض على كرة بيضاء,كلب أسود بيقفز عشان يمسك كرة بيضاء
6190.0,3544673666_ffc7483c96.jpg,كلب أبيض يقفز في الهواء للقبض على الكرة الطائرة البيضاء,كلب أبيض بيقفز في الهوا عشان يمسك كرة طائرة بيضاء
6191.0,3544793763_b38546a5e8.jpg,رجل في السراويل السوداء  يتلاكم ضد الرجل في السراويل البيضاء,راجل في بنطلون أسود بيتصارع مع راجل في بنطلون أبيض
6192.0,3544803461_a418ca611e.jpg,رجل أسود في شورت أبيض ورجل أبيض في شورت أسود يتلاكمان,راجل أسود في شورت أبيض و راجل أبيض في شورت أسود بيتصارعوا
6193.0,3545427060_c16a8b7dfd.jpg,مجموعة من الأطفال يلعبون في الماء,مجموعة من الولاد بيلعبوا في المية
6194.0,3545586120_283d728a97.jpg,يحاول الرجل الأطول منع الرجل الأقصر,راجل طويل بيحاول يمنع راجل قصير
6195.0,3545652636_0746537307.jpg,لاعب كرة قدم صبي يركض في الملعب,ولد لاعب كرة قدم بيجري في الملعب
6196.0,3545779287_8f52e06909.jpg,كلب أسود وبني لديه حبل في فمه,كلب أسود و بني ماسك حبل في بقه
6197.0,3545793128_af3af544dc.jpg,تجمع حشد من الناس معًا وامرأة واحدة تقف تحمل علامة,ناس كتير متجمعين مع بعض و ست واحدة واقفة ماسكة لافته
6198.0,3546027589_253553252a.jpg,مجموعة من الأطفال يلعبون كرة القدم ويتحدثون خارج مطعم,مجموعة من الولاد بيلعبوا كرة قدم و بيتكلموا برة مطعم
6199.0,354642192_3b7666a2dd.jpg,شخص يطفو في الماء بالقرب من الصخور وشلال,"واحد بيطفو في المية قريب من الصخور و الشلال
"
6200.0,3546474710_903c3c9fd3.jpg,رجل أصلع في فرقة يلعب الغيتار في دائرة الضوء,راجل أصلع في فرقة بيلعب جيتار في ضوء
6201.0,3546720729_38fff1bbd9.jpg,رجل واحد يجلس يلعب غيتار صغير بينما يقف رجل آخر يلعب تشيلو كبيرة,راجل قاعد بيلعب جيتار صغير وراجل تاني واقف بيلعب تشيلو كبيرة
