image_number,image_number,image,text,egyptian,Moroccan
228,228,1271210445_7f7ecf3791.jpg,احتفال بعيد الميلاد يقام لفتاة تبلغ الخامسة من العمر, احتفال بعيد ميلاد لبنت عندها خمس سنين,حفلة عيد ميلاد كا تدوز لبنت عندها خمس سنين
229,229,1271960365_e54033f883.jpg,كلب أسود يركض خلف كلب أسود آخر يحمل كرة, كلب أسود بيجري ورا كلب أسود تاني شايل كرة,كلب أسود كايجري ورا كلب أسود آخر كايحمل كرة
230,230,1273001772_1585562051.jpg,مجموعة من الأطفال في نافورة ماء, مجموعة ولاد في نافورة مية,مجموعة ديال وليدات في نافورة الماء
231,231,127450902_533ceeddfc.jpg,أربعة أشخاص يسيرون في الثلج, أربعة أشخاص ماشيين في الثلج,أربعة ديال الناس كاي مشيو في الثلج
232,232,127488876_f2d2a89588.jpg,شجرة في المقدمة  رجلان يلعبان الجولف في الخلفية, شجرة في المقدمة وراجلان بيلعبوا جولف في الخلفية,شجرة في المقدمة و رجلين كاي لعبو الجولف في الخلفية
233,233,127490019_7c5c08cb11.jpg,فتاة تستعد لدخول النادي, بنت بتجهز تدخل النادي,بنت كا تستعد تدخل النادي
234,234,1277185009_06478dd457.jpg,رجل بدون قميص يسير على لكثير من الصخور, راجل من غير قميص ماشي على كتير من الصخور,راجل بدون قميص كاي مشي على بزاف ديال الحجارة
235,235,1277743944_f4e8c78403.jpg,صبي في سترة حمراء يركض على الشاطئ, ولد لابس جاكيت أحمر بيجري على الشاطئ,وليد لبس سترة حمراء كايجري على الشاطي
236,236,1280147517_98767ca3b3.jpg,قارب على بحيرة, قارب على بحيرة,قارب على بحيرة
237,237,1280320287_b2a4b9b7bd.jpg,اثنين من الفتيان يتزلجان, اتنين ولاد بيتزلجوا,اثنين ديال الوليدات كاي تزلجو
238,238,1282392036_5a0328eb86.jpg,مجموعة من الناس في الزي في معرض نهضة, مجموعة ناس لابسين لبس في معرض نهضة,مجموعة ديال الناس في اللباس في معرض النهضة
239,239,12830823_87d2654e31.jpg,الناس يحدقون في السمك البرتقالي, ناس بيبصوا على سمك برتقالي,الناس كايحدقو في سمك برتقالي
240,240,1285067106_2adc307240.jpg,صبي في الأبيض يلعب البيسبول, ولد لابس أبيض بيلعب بيسبول,وليد في الأبيض كاي لعبو البيسبول
241,241,1285874746_486731a954.jpg,امرأة أفريقية أمريكية تقف في الحشد, ست افريقية أمريكية واقفة في الزحمة,امرأة أفريقية أمريكية كا واقفة في الحشد
242,242,1286408831_05282582ed.jpg,صبي صغير يتسلق مجموعة اللعب في الفناء الخلفي, ولد صغير بيتسلق مجموعة لعب في الفناء الخلفي,وليد صغير كاي تسلق مجموعة اللعب في الفناء الخلفي
243,243,1287064529_aa4e4f3c31.jpg,كلب أسود في الثلج, كلب أسود في الثلج,كلب أسود في الثلج
244,244,1287073593_f3d2a62455.jpg,مجموعة من الكلاب تسحب شخصاً على مزلق فوق تل, مجموعة كلاب بتسحب شخص على مزلق فوق تل,مجموعة ديال الكلاب كا تسحب شخص على مزلق فوق تل
245,245,1287475186_2dee85f1a5.jpg,صبي يجلس في الماء, ولد قاعد في الماية,وليد كاقعد في الماء
246,246,1287920676_d21a0b289b.jpg,كلب أبيض مع أحزمة حمراء عليه ينظر إلى الخلف, كلب أبيض مع أحزمة حمرا عليه بيبص لورا,كلب أبيض مع أحزمة حمراء عليه كيشوف للوراء
247,247,1287931016_fb015e2e10.jpg,كلب أسود وأبيض على الثلج, كلب أسود وأبيض على الثلج,كلب أسود و أبيض على الثلج
248,248,1287982439_6578006e22.jpg,كلب كبير بني يقفز في الماء ويفتح فمه, كلب كبير بني بيقفز في الماية وفاتح بوقه,كلب كبير بني كايقفز في الماء و كايفتح فمه
249,249,1288909046_d2b2b62607.jpg,كلب بني يقفز إلى بركة سباحة في الحديقة," كلب بني بيقفز في بركة سباحة في الحديقة 
"," كلب بني كايقفز لبركة سباحة في الحديقة
"
250,250,128912885_8350d277a4.jpg,كلب يقفز على كرة حمراء على العشب,كلب بيقفز على كرة حمرا على العشب,كلب كا يطيح فوق كرة حمراء فوق العشب
251,251,1289142574_2bd6a082dd.jpg,صبي يقفز من طاولة نزهة إلى أخرى,ولد بيقفز من ترابيزة نزهة لتانية,وليد كا يطيح من طاولة نزهة لواحدة اخرى
252,252,1290894194_8a4ffdc7eb.jpg,امرأة في لباس أحمر وكلب صغير يتحدث إلى فتاة صغيرة,ست لبسة احمر وكلب صغير بيتكلم مع بنت صغيرة,مراة لابسة لباس احمر وكلب صغير كا يهضر مع بنت صغيرة
253,253,1294578091_2ad02fea91.jpg,فنانة تعرض الرسم الخاص بها وتوقع ورقة,فنانة بتعرض الرسم بتاعها وبتوقع ورقة,فنانة كا تعرض الرسم ديالها وكا تسجل في ورقة
254,254,1295669416_21cabf594d.jpg,فتاة ترتدي ثوبا أحمر وأسود مع بنطلون أسود تجلس على الحائط,بنت لبسة فستان احمر واسود مع بنطلون اسود قاعدة على الحيط,بنت لابسة جلباب احمر واسود مع بنطلون اسود كا تجلس فوق الحيط
255,255,1295671216_cde1b9c9d1.jpg,رجل في البلوز الأزرق يلتقط صورة,راجل في بلوزة زرقا بيصور,راجل لابس بلوزة زرقا كا يصور
256,256,1295698260_e10c53c137.jpg,حشد من الناس ينظرون إلى شيء خارج الإطار  رجل يأخذ صورة,زحمة ناس بتبص على حاجة بره الصورة راجل بياخد صورة,جمهور ديال الناس كا يشوفوا شي حاجة برا الاطار راجل كا يصور
257,257,129599450_cab4e77343.jpg,راكب في الجبال يرتدي علم أمريكا,راكب في الجبال لابس علم امريكا,راكب في الجبال لابس علم امريكا
258,258,1296412797_85b6d2f8d6.jpg,طفلة تتأرجح من ذراعيها بينما يشاهد طفل آخر,بنت صغيرة بتتارجح من دراعها بينما طفل تاني بيتفرج,بنت صغيرة كا تتأرجح من ذراعها بينما كا يشوفها وليد اخر
259,259,1296770308_3db2022f5a.jpg,فتاة تجلس على مقعد بار,بنت قاعدة على كرسي بار,بنت كا تجلس فوق كرسي بار
260,260,1298295313_db1f4c6522.jpg,صبي في سترة زرقاء يقفز في الماء,ولد في جاكيت ازرق بيقفز في الميه,وليد لابس جاكيت زرقا كا يطيح في الماء
261,261,1298866571_b4c496b71c.jpg,رجل آسيوي يعطي العين الشريرة للكاميرا,راجل اسيوي بيعمل عين شريرة للكاميرا,راجل آسيوي كا يدير العين الشريرة للكاميرا
262,262,1299459550_1fd5594fa2.jpg,صبي في ثياب السباحة,ولد في لبس سباحة,وليد لابس ثياب سباحة
263,263,1299459562_ed0e064aee.jpg,ثلاثة أولاد يلعبون في رذاذ الماء,تلاتة ولاد بيلعبوا في رذاذ الميه,ثلاثة ولاد كا يلعبوا في رذاذ الماء
264,264,1301140633_046e4e8010.jpg,صبي في قميص أزرق مع الأوساخ على وجهه,ولد في قميص ازرق مع تراب على وشه,وليد لابس قميص ازرق مع التراب على وجهه
265,265,130211457_be3f6b335d.jpg,رجل يضع ذراعيه حول امرأتين تمتثلان لصورة معه,راجل حاطط دراعه حوالين ستين بيتسماحوا في صورة معاه,راجل كا يضع ذراعه حول جوج نساء كا يلتقطوا صورة معاه
266,266,1302657647_46b36c0d66.jpg,رجل يتدلى من القضبان في الهواء الطلق,راجل متدلي من القضبان في الهواء الطلق,راجل كا يتدلى من الحديد في الهواء الطلق
267,267,1303335399_b3facd47ab.jpg,قام طفل صغير بالتزحلق على زحلوقة برتقالية,طفل صغير بيزلج على زحليقة برتقالية,وليد صغير كا يزحلق فوق زحلوقة برتقالية
268,268,1303548017_47de590273.jpg,فتاة تقف على مسار القطار بالقرب من محطة,بنت واقفة على مسار القطر قريب من محطة,بنت كا تقف فوق خط القطار قريب من المحطة
269,269,1303550623_cb43ac044a.jpg,فتاة تقف حافية على مسارات السكة الحديدية,بنت واقفة حافية على مسارات السكة الحديد,بنت كا تقف حافية فوق خطوط السكة الحديدية
270,270,1303727066_23d0f6ed43.jpg,رجل يلبس علامة سلام على قميصه يبتسم,راجل لابس علامة سلام على قميصه بيبتسم,راجل لابس علامة سلام على قميصه كا يبتسم
271,271,1303727828_d1052ee341.jpg,رجل يرتدي قبعة الريش,راجل لابس قبعة ريش,راجل لابس قبعة ريش
272,272,1304100320_c8990a1539.jpg,الكلبان يركضان في حقل من الزهور,الكلبين بيجرى في حقل من الزهور,جوج كلاب كا يركضوا في حقل ديال الزهور
273,273,1304961697_76b86b0c18.jpg,طفلين على ألواح التزلج يلوحان لبعضهما البعض,طفلين على ألواح التزلج بيشاوروا لبعض,جوج ولاد فوق ألواح التزلج كا يلوحوا لبعضهم
274,274,1305564994_00513f9a5b.jpg,قاد المتسابقان الدراجة البيضاء على الطريق,الراكبين بيجرى على دراجة بيضا في الطريق,جوج متسابقين كا يركبوا دراجة بيضاء فوق الطريق
275,275,1306145560_1e37081b91.jpg,كلب أسود يسبح في الماء,كلب اسود بيسبح في الميه,كلب اسود كا يسبح في الماء
276,276,1307635496_94442dc21a.jpg,طفل يمر عبر حقل,طفل بيعدي من حقل,وليد كا يمشي من خلال حقل
277,277,1308472581_9961782889.jpg,فتاة ضاحكة تحمل دلوًا في المحيط,بنت ضاحكة شايلة دلو في المحيط,بنت ضاحكة كا تحمل دلو في المحيط
278,278,1308617539_54e1a3dfbe.jpg,صبي يقفز إلى المحيط,ولد بيقفز في المحيط,وليد كا يطيح في المحيط
279,279,1309330801_aeeb23f1ee.jpg,يلعب الأطفال على الترامبولين,الولاد بيلعبوا على الترامبولين,ولاد كا يلعبوا فوق الترامبولين
280,280,1311132744_5ffd03f831.jpg,كلب أسود ورمزي يركض في الحقل,كلب اسود ورمادي بيجرى في الحقل,كلب اسود ورمادي كا يركض في الحقل
281,281,1311388430_4ab0cd1a1f.jpg,شخص معلق في الهواء من خطوط الكهرباء,شخص متعلق في الهوا من خطوط الكهربا,شخص معلق في الهواء من خطوط الكهرباء
282,282,1312020846_5abb4a9be2.jpg,اثنين من الجراء الصغيرة تطارد بعضها البعض على جدار حجري,اتنين من الجراء الصغيرة بيطاردوا بعض على حيط حجر,جوج جراء صغيرة كا يطاردوا بعضهم فوق جدار حجري
283,283,1312227131_771b5ed201.jpg,الكلاب تعمل في الصباح المشمس,الكلاب بتجرى في الصبح المشمس,كلاب كا تعمل في الصباح المشمس
284,284,1312954382_cf6d70d63a.jpg,فتاة ترتدي فستان أخضر وبرتقالي تمشي في الشارع حاملة بالون,بنت لبسة فستان اخضر وبرتقالي ماشية في الشارع شايلة بالون,بنت لابسة فستان اخضر وبرتقالي كا تمشي في الشارع حاملة بالون
285,285,1313693129_71d0b21c63.jpg,صبي وفتاة يقفون على ضفة النهر,ولد وبنت واقفين على ضفة النهر,وليد وبنت كا يقفوا على ضفة النهر
286,286,1313961775_824b87d155.jpg,طفلة عائمة ترتدي سترة نجاة,بنت صغيرة طافية لبسة سترة نجاة,بنت صغيرة كا تطفو لابسة سترة نجاة
287,287,1316247213_1d2c726dd5.jpg,لقطة مقرّبة لفتاة صغيرة تضحك,لقطة قريبة لبنت صغيرة بتضحك,لقطة مقربة لبنت صغيرة كا تضحك
288,288,131632409_4de0d4e710.jpg,فتاة في البيكيني تمشي على طول الشاطئ مع غيوم ضخمة وشاطئ رملي خلفها,بنت في بكيني ماشية على طول الشاطئ مع غيوم ضخمة وشاطئ رملي وراها,بنت في البيكيني كا تمشي على طول الشاطئ مع غيوم ضخمة وشاطئ رملي وراها
289,289,1317292658_ba29330a0b.jpg,صبي يتمتع  بالمطر,ولد بيستمتع بالمطر,وليد كا يستمتع بالمطر
290,290,1319634306_816f21677f.jpg,كلب بني يجلس في بعض العشب الطويل,كلب بني قاعد في شويه عشب طويل,كلب بني كا يجلس في بعض العشب الطويل
291,291,1321723162_9d4c78b8af.jpg,طفلة صغيرة تمسك بيد مدرب التزلج على الجليد,بنت صغيرة ماسكة ايد مدرب التزلج على الجليد,بنت صغيرة كا تمسك بيد مدرب التزلج على الجليد
292,292,1321949151_77b77b4617.jpg,يستلقي صبي صغير وفتاة صغيرة على مقعد أسود يحيط به الكبار,ولد صغير وبنت صغيرة نايمين على كرسي اسود محيطين بالكبار,وليد صغير وبنت صغيرة كا يناموا فوق كرسي اسود محاط بالكبار
293,293,1322323208_c7ecb742c6.jpg,صبي وفتاة يلعبون على الشاطئ,ولد وبنت بيلعبوا على الشاطئ,وليد وبنت كا يلعبوا على الشاطئ
294,294,1324816249_86600a6759.jpg,كلب بني يقف في حقل خصب مع الغيوم والجبال المذهلة خلفه,كلب بني واقف في حقل خصيب مع غيوم وجبال مذهلة وراه,كلب بني كا يقف في حقل خصيب مع الغيوم والجبال المذهلة وراه
295,295,132489044_3be606baf7.jpg,رجل ينام مع حقيبة في حضنه على وسيلة النقل العام,راجل نايم مع شنطة في حضنه على وسيلة مواصلات عامة,راجل كا ينام مع حقيبة في حضنه فوق وسيلة نقل عامة
296,296,1329832826_432538d331.jpg,يقف الناس على زاوية شارع عند الغسق  مع صيدلية في الخلفية,ناس واقفين على زاوية شارع عند الغسق مع صيدلية في الخلفية,ناس كا يقفوا على زاوية شارع عند الغسق مع صيدلية في الخلفية
297,297,1330645772_24f831ff8f.jpg,كلب أبيض وأسود يركض في العشب,كلب ابيض واسود بيجرى في العشب,كلب ابيض واسود كا يركض في العشب
298,298,133189853_811de6ab2a.jpg,رجل أصلع يقبل رجل آخر على الخد,راجل اقرع بيبوس راجل تاني على الخد,راجل اقرع كا يبوس راجل اخر على الخد
299,299,1332208215_fa824f6659.jpg,يجلس الناس داخل القطار,"ناس قاعدين جوه القطر 
"," ناس كا يجلسوا داخل القطار
"
300,300,1332492622_8c66992b62.jpg,مجموعة من الناس يقفون على شرفة بالقرب من مبنى السيرك الملون, مجموعة من الناس واقفين على البلكونة جنب مبنى السيرك الملون,واحد جماعة ديال الناس واقفين على شرفة قريب من دار السيرك لي ملونة
301,301,1332722096_1e3de8ae70.jpg,ثلاث نساء يقفن في شارع المدينة, تلات ستات واقفين في شارع المدينة,تلات نساء واقفين فشارع المدينة
302,302,1332815795_8eea44375e.jpg,طفل يتأرجح في أرجوحة بالقرب من سياج خشبي, ولد بيتهز في المرجيحة جنب سياج خشبي,واحد ولد صغيور كيتأرجح فالأرجوحة قريب من سياج ديال الخشب
303,303,1332823164_c70a5d930e.jpg,فتاة تقف في المحيط, بنت واقفة في البحر,واحدة بنت واقفة فالبحر
304,304,1333888922_26f15c18c3.jpg,طفل يتأرجح والشمس مشرقة, ولد بيتهز والشمس بتنور,واحد ولد كيتأرجح والشمس كتسنا
305,305,1334892555_1beff092c3.jpg,تلعب الفتيات بسيوف الرغاوي, البنات بيلعبوا بسياف الرغوة,البنات كيتسناو بسهوف ديال الرغوة
306,306,1335617803_4fbc03dab0.jpg,صبيان يرتديان قمصانا زرقاء يقومان بعمل مضحك, ولاد لابسين قمصان زرقا بيعملوا حاجة مضحكة,ولاد لبسين قمصان زرقاء كيديرو واحد الحركة مضحكة
307,307,1337792872_d01a390b33.jpg,فتاة تسير على الطريق تحمل دب, بنت ماشية في الطريق شايلة دب,واحدة بنت كتمشي فطريق حاملة دب
308,308,1338523142_57fce8229b.jpg,يسافر الرحال أسفل جبل صخري, المسافرين بينزلوا من على الجبل الصخري,واحد رحالة كيسافر تحت جبل ديال الحجر
309,309,133905560_9d012b47f3.jpg,جرو يلعب مع كلب بالغ في الثلج, جرو بيلعب مع كلب كبير في الثلج,واحد جرو كيلعب مع كلب كبير فالثلج
310,310,1339596997_8ac29c1841.jpg,ثلاث نساء مسلمات ينظرن إلى كاميرا, تلات ستات مسلمين بيبصوا على الكاميرا,تلات نساء مسلمات كيشوفو فالكاميرا
311,311,1341787777_4f1ebb1793.jpg,الكلب البني ينحني لأسفل في محاولة للشرب من نفاثة الماء, الكلب البني بينحني لتحت عشان يشرب من نافورة الماية,الكلب بني كينحني لتحت باش يشرب من نفاثة الماء
312,312,1342766791_1e72f92455.jpg,صبي يدفع صبيًا آخر إلى أعلى, ولد بيدفع ولد تاني لفوق,واحد ولد كيدفع ولد أخر لفوق
313,313,1342780478_bacc32344d.jpg,يقف رجل يرتدي قميصا وربطة عنق أمام لافتة, راجل لابس قميص وكرافتة واقف قدام لافته,واحد راجل لابس قميص وربطة عنق واقف قدام لافتة
314,314,1343426964_cde3fb54e8.jpg,طفل يضع نظارات قرب الماء في الخارج, ولد حاطط نظارة جنب الماية بره,واحد ولد كحط النظارات قريب من الماء فالخارج
315,315,1346051107_9cdc14e070.jpg,رجل يلعب ساكسفون بجانب صنبور النار, راجل بيلعب ساكسفون جنب حنفية الماية,واحد راجل كيلعب ساكسفون بجوار صنبور النار
316,316,1346529555_e916816cfe.jpg,كلب في الجو يلتقط الكرة الحمراء, كلب في الجو بيلقط الكورة الحمرا,واحد كلب فالسماء كيتسنا الكرة الحمراء
317,317,134724228_30408cd77f.jpg,تسير فتاتان على طريق ترابي في حديقة, بنتين ماشيين في طريق ترابي في الحديقة,جوج بنات كيتمشاو فطريق ترابي فحديقة
318,318,1347519824_e402241e4f.jpg,بعض الشباب يلتقطون الصور لبعضهم البعض أثناء وجودهم في نيويورك, شباب بيلتقطوا صور لبعض في نيويورك,واحد جماعة ديال الشباب كيتصورو بعضياتهم فنيويورك
319,319,1348113612_5bfc5f429e.jpg,كلب أبيض وأسود يقفز في بركة وراء كرات التنس, كلب أبيض واسود بيقفز في بركة ورا كرات التنس,واحد كلب أبيض وأسود كيتقافز فبحر ورا كرات التنس
320,320,1348304997_afe60a61df.jpg,فتاة تقفز على الترامبولين, بنت بتقفز على الترامبولين,واحدة بنت كيتقافز على الترامبولين
321,321,1348891916_ebd4413033.jpg,كلب رطب يلعب في الماء, كلب مبلول بيلعب في الماية,واحد كلب مبلول كيلعب فالماء
322,322,134894450_dadea45d65.jpg,رجل يقفز في الهواء في منطقة حرجية, راجل بيقفز في الهوا في منطقة غابة,واحد راجل كيتقافز فالهواء فغابة
323,323,1348947380_14f0fc1237.jpg,رجل وكلب يقفان على تل يطل على الماء, راجل وكلب واقفين على تل شايفين الماية,واحد راجل وكلب واقفين على تل كيشوفو للماء
324,324,1348957576_c4a78eb974.jpg,رجل وامرأة يجلسان على الأرض محاطان بالقوارب, راجل وست قاعدين على الأرض محاوطين بالقوارب,واحد راجل وواحدة مرا كاقعدين على الأرض محاطين بالقوارب
325,325,1350811702_2ce7cfd0c5.jpg,صبي صغير يلقي خط الصيد الخاص به قبالة رصيف الميناء, ولد صغير بيرمي خيط الصيد بتاعه من على الرصيف,واحد ولد صغير كيرمي خط الصيد ديالو من رصيف الميناء
326,326,1350948838_fdebe4ff65.jpg,كلب أبيض وأسود يقفز في بركة, كلب أبيض واسود بيقفز في بركة,واحد كلب أبيض وأسود كيتقافز فبحر
327,327,1351315701_6580b51c41.jpg,كلب أسود وكلب أبيض يركضان على العشب, كلب اسود وكلب أبيض بيجريوا في العشب,واحد كلب أسود وكلب أبيض كيجريو فالحديقة
328,328,1351764581_4d4fb1b40f.jpg,رجل إطفاء يطفئ النار تحت غطاء محرك السيارة, رجل اطفاء بيطفي النار تحت غطاء محرك العربية,واحد رجل إطفاء كيطفي النار تحت غطاء محرك السيارة
329,329,135235570_5698072cd4.jpg,رجل في حقل يحمل أعلام أمريكية, راجل في الحقل شايل علم امريكا,واحد راجل فحقل كيحمل أعلام أمريكية
330,330,1352398363_9cc8ffcce9.jpg,طفل قذر يلعب في المنزل, ولد وسخ بيلعب في البيت,واحد ولد وسخ كيلعب فالدار
331,331,1352410176_af6b139734.jpg,فتاة شقراء تخطو على سطوح رأسية في الرمال, بنت شقرا بتطلع على اسطح رأسية في الرمال,واحدة بنت شقراء كتمشي على سطوح رأسية فالرمال
332,332,1354318519_2f9baed754.jpg,طفل يضحك, ولد بيضحك,واحد ولد كيدوي
333,333,1355450069_c0675b0706.jpg,رجل يصعد جدارًا, راجل بيطلع حيط,واحد راجل كيسالي جدار
334,334,1355703632_5683a4b6fb.jpg,فتاة تتأهب لرمي الكرة اللينة, بنت بتستعد ترمي الكورة الطرية,واحدة بنت كتحضر باش ترمي الكرة اللينة
335,335,1355833561_9c43073eda.jpg,يتم رمي الطفل في الهواء, ولد بيترمي في الهوا,كيترمي ولد فالجو
336,336,1355935187_2c99648138.jpg,كلب أبيض يركض خارجا من خيمة, كلب أبيض بيجري بره الخيمة,واحد كلب أبيض كيجري برا من خيمة
337,337,1355945307_f9e01a9a05.jpg,رجل يقود سيارة سباق حمراء قديمة الطراز, راجل بيسوق عربية سباق حمرا قديمة,واحد راجل كيسوق سيارة سباق حمراء قديمة
338,338,1356543628_c13ebe38fb.jpg,فتاة في غابة تحمل معدات التخييم, بنت في الغابة شايلة حاجات التخييم,واحدة بنت فغابة كتحمل معدات التخييم
339,339,1356796100_b265479721.jpg,فتاة تنظر من خلال الأوراق على شجرة, بنت بتبص من ورا الاوراق على الشجرة,واحدة بنت كتشوف من خلال الأوراق على شجرة
340,340,1357689954_72588dfdc4.jpg,يحاول صبي تسلق الصخور الصناعية, ولد بيحاول يطلع الصخور الصناعية,واحد ولد كيحاول يسالي الصخور الصناعية
