image_number,image,text,egyptian
4024.0,3101378069_f8caa14c0a.jpg,سيدة في قميص وردي وحجاب أخضر وقبعة من القش تجر قاربًا يحتوي على عبوات,ست في قميص وردي وحجاب أخضر وقبعة قش بتجرّ زورق فيه عبوات
4025.0,3101796900_59c15e0edc.jpg,يلعب الكلب البني والكلب الأسود مع الفريسبي الأحمر,كلب بني وكلب أسود بيلعبوا بالفريسبي الأحمر
4026.0,310213587_778fe8fb5b.jpg,مجموعة من الناس يجلسون على مقاعد في حديقة المدينة,شوية ناس قاعدين على كراسي في حديقة المدينة
4027.0,3102204862_f1d220230b.jpg,رجل يرمي  رجلا آخر في حلبة مصارعة,راجل بيرمي راجل تاني في حلبة مصارعة
4028.0,3102363657_dc95fe6850.jpg,طفل يعانق شخصاً في زي نحلة كبير,طفل بيحضن واحد لابس لبس نحلة كبير
4029.0,310260324_7f941814bc.jpg,ترفع مجموعة من الرجال أذرعهم للإشارة بينما ينظرون إلى اليسار,شوية رجالة رافعين ايديهم عشان يشيرّوا وبيشوفوا لشمال
4030.0,3103185190_eb8729c166.jpg,فتاة تقفز على قمة الجبل,بنت بتقفز على قمة الجبل
4031.0,3103231330_db98b14501.jpg,رجل في سترة زرقاء وقفازات يقف في الشارع بين أشخاص آخرين,راجل في جاكيت أزرق وقفازات واقف في الشارع بين ناس
4032.0,3103264875_2a8d534abc.jpg,يحمل الكلب لعبة برتقالية في فمه,كلب ماسك لعبة برتقالية في بوقه
4033.0,3103340819_46de7954a9.jpg,زوجان يجلسان على الخرسانة خارج مجموعة من الأبواب الخشبية البنية الكبيرة,زوجين قاعدين على الأسمنت برة مجموعة أبواب خشبية كبيرة بنية
4034.0,3103587323_7f093d5b90.jpg,طفل يمسك بذيل التمساح المزيف,طفل ماسك في ذيل تمساح صناعي
4035.0,3104182973_5bb1c31275.jpg,مجموعة من الناس بالقرب من شجرة عيد الميلاد,شوية ناس قريبين من شجرة عيد الميلاد
4036.0,3104400277_1524e4f758.jpg,سائقو دراجات ترابية على طريق,سواقين دراجات ترابية على طريق
4037.0,3104690333_4314d979de.jpg,طفلين يلعبان في الثلج,اتنين ولاد بيلعبوا في الثلج
4038.0,3104909823_0f41dd8be6.jpg,يقف رجلان يرتديان سترات وقبعات على شرفة,اتنين رجالة لابسين جواكت وقبعات واقفين على بلكونة
4039.0,3105315670_5f86f73753.jpg,امرأة تمشي في شارع  في المدينة,ست ماشية في شارع في المدينة
4040.0,3105623068_392b767a7b.jpg,امرأة ترتدي قميصا أبيضا وسروالا أسودا  تتسلق جدارا صخري,ست لابسة قميص أبيض وبنطلون أسود بتسلق حيط صخري
4041.0,3105691757_817083b0a6.jpg,موكب من الناس يسير في أزياء سانتا في شارع في المدينة,موكب من الناس ماشيين في لبس بابا نويل في شارع في المدينة
4042.0,3105929913_94a6882e25.jpg,أربعة أشخاص صلع يصلون أو يتأملون,أربعة أشخاص أصلع بيدعوا أو بيفكروا
4043.0,3106026005_473a7b1c8c.jpg,رجل يجلس على مقعد في شارع سان دييغو,راجل قاعد على كرسي في شارع سان دييجو
4044.0,3106223494_52d4d2d75d.jpg,رجل في قناع ويرتدي بدلة سانتا كلوز,راجل لابس قناع ولبس بابا نويل
4045.0,3106340185_80d0cb770a.jpg,رجل يأخذ صورة من نافذة,راجل بياخد صورة من الشباك
4046.0,3106562372_e349a27764.jpg,فتاة تقفز في الهواء بينما ترشاهدها فتاة أخرى,بنت بتقفز في الهوا وواحدة بتشوفها
4047.0,3106782647_b078830a9e.jpg,رجل محمول جوا على دراجة هوائية,راجل طاير على دراجة هوائية
4048.0,3106787167_e5f2312622.jpg,يحاول لاعبي الرجبي المتسخين بالوحل ردع الرجل الذي يحمل الكرة,لاعبي الرجبي المتوسخين بالطين بيحاولوا يمنعوا الراجل اللي ماسك الكورة
4049.0,3106791484_13e18c33d8.jpg,صبي صغير يقفز على السرير,"ولد صغير بيقفز على السرير
"
4050.0,3106857210_07a92577fc.jpg,امرأة في قميص أصفر تسير في شارع مشمس,ست لبسه فستان أصفر ماشيه في شارع مشمس
4051.0,3106883334_419f3fb16f.jpg,يركض كلب بني داكن خلف كلب أصفر فوق العشب,كلب بني غامق بيجري وراه كلب أصفر فوق العشب
4052.0,3107059919_0594269f72.jpg,فتاة صغيرة ذات شعر داكن تركض على الشاطئ,بنت صغيره شعرها غامق بتجري على الشاطئ
4053.0,310715139_7f05468042.jpg,كلب يقفز على الشاطئ,كلب بيقفز على الشاطئ
4054.0,310728631_155c3bbeea.jpg,قطيع من الطيور تحلق فوق لوحة جدارية صينية على مبنى,طقم طيور بيطير فوق لوحه صينيه على بنايه
4055.0,3107368071_724613fc4f.jpg,حشد من الأطفال وبعضهم يرتدون أزياء خضراء,جمهور أطفال و بعضهم لابسين لبس أخضر
4056.0,3107463441_7c68606450.jpg,رجل وامرأة يقومان بتجميع بنية معدنية,راجل وست بيجمعوا بنايه حديديه
4057.0,3107513635_fe8a21f148.jpg,مجموعة من الناس في محطة القطار,جمهور ناس في محطة القطر
4058.0,3107558821_f3b205d4ed.jpg,تقف امرأتان على حافة المبنى وتنظران إلى مدينة,ستين واقفين على حافة البنايه و بيشوفوا مدينه
4059.0,3107592525_0bcd00777e.jpg,سيدة ورجل يرتديان عباءات المطر,ست و راجل لابسين معاطف المطر
4060.0,3107889179_106d223345.jpg,جدة وطفل صغير يجلسان على طاولة تخدمها امرأة في قميص أسود,جدّه و طفل صغير قاعدين على طاوله و ست لابسه فستان أسود بتخدمهم
4061.0,3108197858_441ff38565.jpg,مجموعة من الأطفال يرفعون أيديهم في الهواء,جمهور أطفال رافعين ايديهم في الهوا
4062.0,3108378861_d2214d971e.jpg,رجل وامرأة  كلاهما يرتديان الأبيض  على الصخور,راجل وست لبسين أبيض على الصخور
4063.0,3108544687_c7115823f5.jpg,رجل وامرأة يجلسان على الصخور,راجل وست قاعدين على الصخور
4064.0,3108732084_565b423162.jpg,رجل في معطف أبيض يقفز على لوح تزلج على الجليد,راجل لابس معطف أبيض بيقفز على لوح تزلج على الجليد
4065.0,3109124656_626b596d5e.jpg,زوجان يجلسان على أريكة زهرية اللون بينما تبتسم امرأة مسنة في الخلفية,زوجين قاعدين على كنبه لونها وردي و ست عجوز بتبتسم في الخلفيه
4066.0,3109136206_f7d201b368.jpg, كلب بني يبدأ بالسير في الماء, كلب بني بيبدأ يمشي في الميه
4067.0,3109268897_d43797fc6a.jpg,رجل مسن مرتدي ثيابا بشكل ذكي,راجل عجوز لابس هدوم شيك
4068.0,3109688427_d2e702456c.jpg,رجل وفتاتان ينظران إلى شيء ما في الغابة,راجل و بنتين بيشوفوا حاجه في الغابه
4069.0,3109704348_c6416244ce.jpg,الرجال يلعبون كرة القدم,الرجاله بيلعبوا كرة قدم
4070.0,3109780402_dbae082dc5.jpg,امرأتان في كشك الحمام,ستين في كشك الحمام
4071.0,3110018626_307a123b59.jpg,اثنين من الكلاب يركضان في حقل,اتنين كلاب بيجرى في الحقل
4072.0,3110174991_a4b05f8a46.jpg,رجل وامرأة يحدقان في الأرض,راجل وست باظين ناظرين للأرض
4073.0,3110614694_fecc23ca65.jpg,كلب يجري على الثلج و في فمه كرة ثلج,كلب بيجري على الثلج و في بقه كرة ثلج
4074.0,3110649716_c17e14670e.jpg,رجل يساعد رجل آخر على ربط شريط أحمر على ذراعه,راجل بيساعد راجل تاني يربط شريط أحمر على دراعه
4075.0,3111208043_dbe8e87fa1.jpg,رجل يركض على مضمار سباق,راجل بيجري على مسار سباق
4076.0,3111402233_6285bcba7a.jpg,كلب بني مبلول ينفض عنه الماء,كلب بني مبلول بيهز نفسه
4077.0,311146855_0b65fdb169.jpg,رجل وامرأة في ملابس احتفالية يرقصان,راجل وست لبسين هدوم عيد بيرقصوا
4078.0,3111482098_11c0f4f309.jpg,يقود شخص عربة ذو عجلات كبيرة عبر منظر صحراوي برتقالي,شخص بيقود عربيه عجلاتها كبيره في صحرا برتقالي
4079.0,3111502208_71e2a414f5.jpg,امرأتان في منافسة تزحلق تسحقان بعضها البعض,ستين في مسابقه زحلق بيضربوا بعض
4080.0,3111897772_5211a37a02.jpg,مجموعة من الفتيات في فساتين ترقص,جمهور بنات لبسين فساتين بيرقصوا
4081.0,311196733_03966b4836.jpg,رجل ينظر من نافذة الركاب التابعة للسيارة صفراء لرؤية الإطارات و هي تخرج الدخان,راجل بيشوف من شباك العربيه الصفرا الاطارات و هي بتطلع دخان
4082.0,3112635165_2d614d7c1a.jpg,كلب أبيض وأسود اللون يحمل عصا في مخلبه لمضغها أو للعب بها,كلب أبيض و أسود بيمسك عصا في مخلبه عشان يمضغها أو يلعب بيها
4083.0,311267421_e204e643cf.jpg,كلب أبيض وأسود و كلب بني وأبيض يركضا في حقل عشبي أمام مجموعة الأشجار,كلب أبيض و أسود و كلب بني و أبيض بيجرى في حقل عشبي قدام جمهور شجر
4084.0,3112821789_1f7c3bbb99.jpg,رجل ينفخ في أداة كهربائية بواسطة ميكروفون,راجل بينفخ في أداة كهربائيه بواسطة ميكروفون
4085.0,3113322995_13781860f2.jpg,مجموعة من كلا الهاسكي تمر عبر الأرض الثلجية,جمهور كلاب هاسكي بتعدي من على الأرض الثلجيه
4086.0,3113682377_14fc7b62b0.jpg,اصدقتان تقفان لالتقاط صورة ليلا,صاحبات واقفين عشان ياخدوا صوره بالليل
4087.0,3113769557_9edbb8275c.jpg,امرأة تقف و ذراعيها إلى جانبيها بينما أخرى تأخذ صورة,ست واقف و إيديها جنب بعض و واحده تانيه بتاخد صوره
4088.0,3114944484_28b5bb9842.jpg,فتاة ترتدي قميص أحمر تنظر إلى أمها في حشد من الناس يجلسون على كراسي بيضاء بلاستيكية,بنت لابسه فستان أحمر بتشوف مامتها في جمهور ناس قاعدين على كراسي بيضاء بلاستيك
4089.0,3115174046_9e96b9ce47.jpg,متزلج يطير من الدرج,متزلج بيطير من على السلم
4090.0,3115354165_44dbeec6c1.jpg,متزلج في الهواء,متزلج في الهوا
4091.0,3115901702_f07aa0ef74.jpg,امرأة تمشي وهي تنظر إلى هاتفها المحمول وينظر إليها الآخرون,ست بتمشي و بتشوف في تليفونها و الناس بتشوفها
4092.0,3116011063_f4071ccce6.jpg,رجل يسقط عن لوح ركوب الأمواج في المحيط,راجل بيقع من على لوح ركوب الأمواج في البحر
4093.0,3116039960_54d1d68145.jpg,فتاة تحمل بالون أزرق أثناء سيرها,بنت شايله بالون أزرق و هي بتمشي
4094.0,311619377_2ba3b36675.jpg,امرأة تنظر إلى طبق مليء بالبخار,ست بتشوف طبق مليان بخار
4095.0,3116379964_86986750af.jpg,كلب وشخصان,كلب و اتنين ناس
4096.0,3116731299_6139b25c18.jpg,يحمل كلب صغير عصا صغيرة في فمه,كلب صغير شايل عصا صغيره في بقه
4097.0,3116769029_f5a76f04ba.jpg,صبي في معطف أسمر يلقي بعض الأوراق الحمراء على الكاميرا,ولد لابسين معطف بني بيرمي شويه ورق أحمر على الكاميرا
4098.0,3116985493_04b1dc3345.jpg,سيدة وابنتها تقفزان في بركة سباحة,ست و بنتها بيقفزوا في حوض سباحه
4099.0,3117336911_a729f42869.jpg,أطفال يلعبون في بركة,"أطفال بيلعبوا في حوض سباحه
"
4100.0,3117562746_62f57a02b5.jpg,كلب يطارد كلب آخر,كلب بيجري ورا كلب تاني
4101.0,3118425885_f0cc035032.jpg,امرأة شابة تأكل في مطعم مزدحم,بنت صغيرة بتاكل في مطعم زحمة
4102.0,3118505332_b0792489b5.jpg,رجل وامرأة يقفان لالتقاط صورة,راجل و ست بتقفوا عشان يصوروا
4103.0,3118534315_cc03e5ddab.jpg,رجل يسجل شيئًا يحمل و هناك راية حمراء خلفه,راجل بيسجل حاجة و شايلها و وراه راية حمرا
4104.0,3119076670_64b5340530.jpg,متزلج على الثلج يطير في الهواء,متزلج بيطير في الهوا
4105.0,3119696225_b289efaec8.jpg,راكب الدراجة يقوم بأداء حيلة على الجرف قرب الماء,راجل بيعمل حركه على الدراجة على حافة البحر
4106.0,3119875880_22f9129a1c.jpg,صبي يتسلق الصخور,ولاد صغير بيطلع على الصخور
4107.0,3119887391_212f379797.jpg,رجل وامرأة يبتسمان,راجل و ست بيضحكوا
4108.0,3119887967_271a097464.jpg,رجل في سترة يشير إلى الكاميرا,راجل لابس جاكيت بيشاور للكاميرا
4109.0,3119903318_d032141839.jpg,رجل يرتدي سروالا قصيرا يقف بالقرب من تأثيرات خاصة متفجرة,راجل لابس بنطلون قصير واقف جنب انفجار
4110.0,3119913014_688d4997d7.jpg,رجل يرتدي سترة سوداء يمشي على ph,راجل لابس جاكيت اسود ماشي على الثلج
4111.0,3120189281_1938460e85.jpg,رجل وطفل يمشيان على الثلج مع كلبين,راجل و ولد ماشيين على الثلج مع كلبين
4112.0,3120266797_47e7d91614.jpg,تقف مجموعة في المسافة القريبة بينما تلقي السماء ضوءًا مثيرًا على بعض الغيوم,مجموعة واقفة من بعيد و السما بتنور من ورا الغيوم
4113.0,3120648767_812c72eabe.jpg,سائق دراجة ترابية في الصحراء,راجل بيدوس دراجة نارية في الصحرا
4114.0,3120953244_b00b152246.jpg,صبي ينفخ فقاعات على الكاميرا,ولاد صغير بينفخ بالونات على الكاميرا
4115.0,3121482932_f77ca12c01.jpg,رجل يلبس الجينز يركب دراجة رباعية الدفع فوق الرمل,راجل لابس جينز بيدوس دراجة رباعية على الرمل
4116.0,3121521593_18f0ec14f7.jpg,امرأة تحني رأسها على كتف امرأة أخرى,ست بتحط راسها على كتف ست تانية
4117.0,312156254_ef31dca5ed.jpg,كلب أسود يهجم على كرة على الأوراق,كلب اسود بيجري ورا كورة على الاوراق
4118.0,3122497129_d08f5729b8.jpg,كلبان يتقاتلان على الثلج,كلبين بيتخانقوا على الثلج
4119.0,3122579598_14841c038a.jpg,جرو لعوب يعض قميص صبي صغير,جرو بيلعب و بيعض قميص ولد صغير
4120.0,3122606953_a979dd3d33.jpg,كلبان أسودان يمشيان عبر الثلج,كلبين سود بيمشوا على الثلج
4121.0,3122773470_b622205948.jpg,مجموعة من الناس يحملون حقائبهم عبر حقل عشبي,مجموعة ناس شايلين شنطهم في حقول عشب
4122.0,3122888809_9ae9b4b9b2.jpg,كلب أسود وكلب بني يشمان أنوف بعضهما البعض,كلب اسود و كلب بني بيشموا بعض
4123.0,3122938209_2b2c6c1fab.jpg,رجل يرتدي لباسا أسود يركب دراجة خضراء,راجل لابس لبس اسود بيدوس دراجة خضرا
4124.0,3123351642_3794f2f601.jpg,متزلج في الجو  بعد أن قفز منحدر,متزلج في الهوا بعد ما نزل من المنحدر
4125.0,3123463486_f5b36a3624.jpg,كلب يجري,كلب بيجري
4126.0,3123526484_02952e40fc.jpg,زوجان يقفان خارج أحد الشوارع,زوجين واقفين برة في الشارع
4127.0,3123770450_cedc16d162.jpg,أيل و عدد من الديوك الرومية معا في الثلج,غزال و مجموعة ديوك رومية مع بعض في الثلج
4128.0,312427606_defa0dfaa8.jpg,فتاة ذات شعر أشقر تأكل الخوخ,بنت شعرها اصفر بتاكل خوخ
4129.0,3124549928_10904a5a83.jpg,طفل يستعد لرمي كرة ثلج,ولد صغير مستعد يرمي كرة تلج
4130.0,3124838157_7ef96745b7.jpg,رجل وامرأتان يقفون لأخذ صورة خارج بقالة,راجل و ستين واقفين عشان يصوروا برة بقالة
4131.0,3124964754_2e8a98fb09.jpg,رجل يقفز على برميل أثناء التزلج,راجل بيقفز على برميل وهو بيزلج
4132.0,3125041578_c1f2d73b6d.jpg,متزلج على الجليد يتزلج حول الحلبة,متزلج على الجليد بيزلج حوالين الحلبة
4133.0,3125158798_0743dae56e.jpg,رجل وامرأة يقفان لأخذ صورة في شارع مرصوف بالحصى,راجل و ست واقفين عشان يصوروا في شارع مرصوف
4134.0,3125309108_1011486589.jpg,مجموعة من الرجال يحملون رجلا للحصول على كرة الرجبي,مجموعة رجالة شايلين راجل عشان يمسكوا الكورة
4135.0,3125628091_25a31709df.jpg,طفلة صغيرة ترتدي بلوزة ذات أكمام طويلة خضراء و رأسها على وسادة,بنت صغيرة لابسة بلوزة خضرا و راسها على مخدة
4136.0,3126225245_96cd2c053f.jpg,أطفال صغار يلعبون بفقاعات يصنعها شخص بالغ,ولاد صغيرين بيلعبوا بالونات و حد كبير بيعملها
4137.0,3126681108_f88128699c.jpg,فتاة صغيرة تجرف الثلج أمام منزل,بنت صغيرة بتكنس الثلج قدام البيت
4138.0,3126724531_f483e1b92a.jpg,رجل يقف على لوح ركوب الأمواج ويهبط أسفل موجة كبيرة,راجل واقف على لوح و بينزل من تحت موجة كبيرة
4139.0,3126752627_dc2d6674da.jpg,لاعب كرة سلة يحاول منع لاعب آخر من التسديد,لاعب كرة سلة بيحاول يمنع لاعب تاني من تسجيل
4140.0,3126773489_7ae425af17.jpg,لاعب كرة سلة يدافع ضد لاعب آخر,لاعب كرة سلة بيدافع عن نفسه ضد لاعب تاني
4141.0,3126795109_73920ed5dc.jpg,لاعب كرة سلة أصلع يقف في الملعب و الكرة بيده اليمنى,لاعب كرة سلة اقرع واقف في الملعب و الكورة في ايده اليمنى
4142.0,3126981064_1e803c3d7f.jpg,رجل يرتدي بذلة سوداء يتصفح موجة كبيرة,راجل لابس بدلة سودا بيمشي على موجة كبيرة
4143.0,3127142756_bf0bfcb571.jpg,كلبان أسودان على الثلج,كلبين سود على الثلج
4144.0,3127614086_9f1d3cf73d.jpg,يحاول لاعب كرة سلة الحصول على كرة السلة من لاعب آخر,لاعب كرة سلة بيحاول ياخد الكورة من لاعب تاني
4145.0,3127629248_a955b5763b.jpg,أربعة لاعبي كرة سلة  أمام حشد من الناس,اربعة لاعيبة كرة سلة قدام مجموعة ناس
4146.0,3127888173_9a9a8ac3bd.jpg,يقف الأطفال الصغار معا ويحصلون على جائزة عن شيء ما,ولاد صغيرين واقفين مع بعض و بيخدوا جائزة
4147.0,3128164023_ebe8da4c32.jpg,الكلاب تطارد بعضها البعض,كلاب بتجري ورا بعض
4148.0,3128514681_a51b415c31.jpg,سيدتان ترتديان فساتين تقفان على جانب الطريق لأخذ صورة في الليل,ستين لابسين فساتين واقفين على جنب الطريق عشان يصوروا بالليل
4149.0,3128856481_86e5df4160.jpg,بطة بيضاء تمد جناحيها في الماء,"بطة بيضا بتفتح جناحيها في الميه 
"
4150.0,3130064588_6d1d3fa2dd.jpg,صبيان يجلسان على متن قارب في الماء,ولاد قاعدين على متن قارب في الميه
4151.0,3130093622_362f32f2bb.jpg,كلب أسود وبني يقفز عبرالثلج,كلب أسود وبني بيقفز فوق التلج
4152.0,313051099_1bb87d6c56.jpg,صورة مقربة لوجه كلب أبيض بينما هو يحمل عصا في فمه,صورة قريبة لوش كلب أبيض وهو ماسك عصاية في بوقه
4153.0,3130970054_04a3865c43.jpg,أربعة أطفال يقفزون إلى البركة,أربعة ولاد بيقفزوا في البركة
4154.0,3131107810_7e9b96cddc.jpg,مجموعة من الأطفال يجلسون مقابل سياج مغطى ببطانية,مجموعة من الولاد قاعدين قدام سياج مغطي ببطانية
4155.0,3131160589_dc73c209b7.jpg,رجل يرتدي بدلة سانتا يتسلق مبنى خرساني كبير,راجل لابس بدلة بابا نويل بيتسلق مبنى كبير من خرسانة
4156.0,3131632154_098f86f4cb.jpg,كلبان أسودان يبحثان عن ألعاب في الثلج,اتنين كلاب سود بيفتشوا عن لعب في التلج
4157.0,3131990048_369b081021.jpg,طائر يغوص للحصول على بعض الطعام,طائر بيغوص عشان ياخد شويه أكل
4158.0,3132006797_04822b5866.jpg,ثلاثة أطفال يلعبون على الأرض بالدمى,تلاتة ولاد بيلعبوا على الأرض بالدمى
4159.0,3132619510_7dfc947d25.jpg,كلبان يجريان على طول السياج,اتنين كلاب بيجرى على طول السياج
4160.0,3132760860_3e743a935d.jpg,يقفز متزلج على الماء في الهواء بينما يمسك بحبل أصفر,متزلج بيقفز في الهوا وهو ماسك حبل أصفر
4161.0,3132832452_c354c6396c.jpg,عائلة تحيط بطفل في حضن أبيه,عيلة حاطة طفل في حضن ابوه
4162.0,3132903412_b4780d0ccf.jpg,شخصان يشعران بالبرد يقفان بالقرب من عمود,اتنين أشخاص بيحسوا بالبرد واقفين جنب عمود
4163.0,3133044777_8cc930a4ec.jpg,منضدة فاكهة مع بائعها,تروبيزة فاكهة مع بائعها
4164.0,313326614_b2adbe59e0.jpg,رجل مرتدي سترة حمراء يقف في أعلى سلالم الملعب,راجل لابس جاكيت أحمر واقف فوق سلم الملعب
4165.0,3133403457_95dfe11da1.jpg,طفل يرتدي قفازات خضراء كبيرة,طفل لابس قفازات خضرا كبيرة
4166.0,3133825703_359a0c414d.jpg,طفل يحدق في سانتا,طفل باصص لبابا نويل
4167.0,3134092148_151154139a.jpg,رجل على لوح ركوب الأمواج,راجل على لوح ركوب الأمواج
4168.0,3134341610_3c55e373a7.jpg,سانتا وامرأة يشربان النبيذ بجانب شجرة الكريسماس و هما يرتديان نظارات تمويه مضحكة,بابا نويل و ست لابسين نظارات تمويه مضحكة وبيشربو خمرة جنب شجرة الكريسماس
4169.0,3134385454_4f1d55333f.jpg,فتاة تقفز في بلاكة سباحة مع رجل بملابس لونها أسود,بنت بتقفز في بلاكة سباحة مع راجل لابس لبس اسود
4170.0,3134387321_3a253224c1.jpg,صورة مقربة لثلاثة أشخاص يبتسمون أمام الكاميرا,صورة قريبة لتلاتة أشخاص بيبتسموا قدام الكاميرا
4171.0,3134387513_ceb75bea0a.jpg,زوجان يتمتعان بشيء من الحياة الليلية يبتسمان للكاميرا,اتنين بيحبوا الحياة الليلية وبيبتسموا للكاميرا
4172.0,3134585858_a8c3493ca5.jpg,رجل وامرأة يرتديان معاطف سوداء,راجل وست لابسين معاطف سودا
4173.0,3134586018_ae03ba20a0.jpg,زوجان يرتديان معاطف شتوية يستعدان لأخذ صورة,اتنين لابسين معاطف شتوى بيستعدوا عشان ياخدوا صورة
4174.0,3134644844_493eec6cdc.jpg,رجل يعزف على الغيتار لفتاة صغيرة في المستشفى,راجل بيعزف على الجيتار لبنت صغيرة في المستشفى
4175.0,3135504530_0f4130d8f8.jpg,فتاتان آسيويتان تضحكان معا,اتنين بنات آسيويات بيضحكوا مع بعض
