image_number,image_number,image,text,egyptian,Moroccan
0,0,1000268201_693b08cb0e.jpg,طفلة صغيرة تتسلق إلى مسرح خشبي,بنت صغيرة بتسلق على مسرح خشب,بنت صغيرة كتقلب لواحد مسرح ديال الخشب
1,1,1001773457_577c3a7d70.jpg,كلب أسود وكلب ثلاثي الألوان يلعبان مع بعضهما البعض على الطريق,كلب أسود وكلب تلات ألوان بيلعبوا مع بعض على الطريق,كلب أسود وكلب تلاتة ألوان كيلعبوا مع بعضهم ف الطريق
2,2,1002674143_1b742ab4b8.jpg,فتاة صغيرة مغطاة بالطلاء تجلس أمام قوس قزح,بنت صغيرة مغطية بالبوية قاعدة قدام قوس قزح,بنت صغيرة مغطية بالطلاء كتقعد قدام قوس قزح
3,3,1003163366_44323f5815.jpg,رجل يجلس على مقعد بينما يجلس كلبه بجانبه,راجل قاعد على كرسي و كلبه قاعد جنبه,راجل كيقعد على كرسي و كلب ديالو كيقعد جنبو
4,4,1007129816_e794419615.jpg,رجل يرتدي قبعة برتقالية,راجل لابس قبعة برتقالي,راجل لابس قبعة برتقالية
5,5,1007320043_627395c3d8.jpg,طفل يلعب على حبل,طفل بيلعب على حبل,وليد كيقلب على حبل
6,6,1009434119_febe49276a.jpg,كلب أبيض وأسود يركض في حديقة عشبية محاطة بسياج أبيض,كلب أبيض وأسود بيجري في حديقة عشبية محاطة بسياج أبيض,كلب أبيض وأسود كيجري ف حديقة عشبية محاطة بسياج أبيض
7,7,1012212859_01547e3f17.jpg,كلب يهز رأسه بالقرب من الشاطئ  كرة حمراء بجانبه,كلب بيحرك راسه قريب من الشاطئ و كرة حمرا جنبه,كلب كيهز راسو حدا الشاطئ و كرة حمراء جنبو
8,8,1015118661_980735411b.jpg,صبي يبتسم أمام حائط صخري في مدينة,ولد بيبتسم قدام حيط صخري في مدينة,وليد كيبسم قدام حيط صخري ف مدينة
9,9,1015584366_dfcec3c85a.jpg,كلب أسود يقفز فوق الجذع,كلب أسود بيقفز فوق جذع شجرة,كلب أسود كيتسلق فوق الجذع
10,10,101654506_8eb26cfb60.jpg,كلب أبيض وأبيض يمر عبر الثلج,كلب أبيض وأسود بيعدي في الثلج,كلب أبيض وأبيض كيمشي ف الثلج
11,11,101669240_b2d3e7f17b.jpg,رجل في القبعة يعرض صورًا بجوار أحد المتزلجين في قبعة زرقاء,راجل في قبعة بيوري صور جنب واحد بيتزلج في قبعة زرقا,راجل فالقبعة كيبين صور حدا واحد المتزلجين فالقبعة زرقاء
12,12,1016887272_03199f49c4.jpg,صور لشخص واحد يتسلق جرفًا,صور لواحد بيتسلق جبل,صور ديال واحد كيتسلق واحد الجرف
13,13,1019077836_6fc9b15408.jpg,كلب بني يطارد الماء على العشب,كلب بني بيطارد الماية على العشب,كلب بني كيطارد الماء على العشب
14,14,1019604187_d087bf9a5f.jpg,كلب يستعد للقبض على جسم في حقل مع السيارات القريبة,كلب مستعد يمسك حاجة في حتة فيها عربيات,كلب كيتحضر باش يمسك شي حاجة ف الحقل و سيارات قريبة
15,15,1020651753_06077ec457.jpg,كلب أبيض وأسود يقفز في الهواء للحصول على لعبة,كلب أبيض وأسود بيقفز في الهوا عشان يمسك لعبة,كلب أبيض وأسود كيتسلق ف الهواء باش يمسك لعبة
16,16,1022454332_6af2c1449a.jpg,طفل وامرأة على حافة المياه في مدينة كبيرة,طفل و ست في حافة الماية في مدينة كبيرة,وليد وامراة ف حافة الماء ف مدينة كبيرة
17,17,1022454428_b6b660a67b.jpg,زوجان يجلسان على العشب مع رضيع وعربة أطفال,اتنين قاعدين على العشب مع بيبي و عربية اطفال,زوج كيقعدوا على العشب مع وليد و عربية أطفال
18,18,1022975728_75515238d8.jpg,كلب يقفز في الماء,كلب بيقفز في الماية,كلب كيتسلق فالماء
19,19,102351840_323e3de834.jpg,رجل يحفر حفرة في الجليد,راجل بيحفر حفرة في الثلج,راجل كيحفر حفرة ف الثلج
20,20,1024138940_f1fefbdce1.jpg,كلاب بيضاء تلعب على الشاطئ,كلاب بيضا بتلعب على الشاطئ,كلاب بيضاء كتلعب ف الشاطئ
21,21,102455176_5f8ead62d5.jpg,رجل يتسلق الجليد,راجل بيتسلق الثلج,راجل كيتسلق ف الثلج
22,22,1026685415_0431cbf574.jpg,كلب أسود يحمل شيئًا على العشب,كلب أسود شايل حاجة على العشب,كلب أسود كيحمل شي حاجة على العشب
23,23,1028205764_7e8df9a2ea.jpg,رجل ورضيع في قوارب الكاياك الصفراء على الماء,راجل و بيبي في قوارب كاياك صفرا على الماية,راجل و وليد ف قوارب الكاياك الصفراء على الماء
24,24,1030985833_b0902ea560.jpg,كلب أسود وكلب بني يقفزان للقبض على لعبة حمراء,كلب أسود و كلب بني بيقفزوا عشان يمسكوا لعبة حمرا,كلب أسود وكلب بني كيتسلقوا باش يمسكوا لعبة حمراء
25,25,103106960_e8a41d64f8.jpg,طفل يرتدي سترة حمراء يلعب هوكي,طفل لابس جاكيت أحمر بيلعب هوكي,وليد لابس سترة حمراء كيقلب هوكي
26,26,103195344_5d2dc613a3.jpg,رجل يجلس ويقرأ صحيفة,راجل قاعد بيقرأ جريدة,راجل كيقعد و كيقرا جريدة
27,27,103205630_682ca7285b.jpg,يتم وضع خيمة على الجليد,بيحطوا خيمة على الثلج,خيمة كتحط ف الثلج
28,28,1032122270_ea6f0beedb.jpg,امرأة تجثم بالقرب من ثلاثة كلاب في حقل,ست قاعدة جنب تلات كلاب في حتة فيها عشب,امراة كتقعد حدا تلاتة كلاب ف الحقل
29,29,1032460886_4a598ed535.jpg,رجل يقف أمام ناطحة سحاب,راجل واقف قدام ناطحة سحاب,راجل واقف قدام ناطحة سحاب
30,30,1034276567_49bb87c51c.jpg,طفل يقضم سلعة مخبوزة,طفل بياكل حاجة مخبوزة,وليد كياكل خبزة
31,31,104136873_5b5d41be75.jpg,ثلاثة أشخاص على قمة تطل على واد أخضر,تلات أشخاص على قمة بتطل على وادي أخضر,تلاتة ناس ف قمة كتشوف واد أخضر
32,32,1042020065_fb3d3ba5ba.jpg,صبي في قميص أخضر يشاهد القوارب,ولد لابس قميص أخضر بيشوف القوارب,وليد ف قميص أخضر كيشوف القوارب
33,33,1042590306_95dea0916c.jpg,رجل وامرأة يمثلان للكاميرا بينما ينظر رجل آخر,راجل و ست بيمثلوا للكاميرا و راجل تاني بيشوف,راجل وامراة كيمثلوا للكاميرا و راجل أخر كيشوف
34,34,1045521051_108ebc19be.jpg,شخص يجلس على الأرض ويأكل أمام التلفزيون,واحد قاعد على الأرض بياكل قدام التلفزيون,واحد كيقعد على الأرض و كياكل قدام التلفزيون
35,35,1048710776_bb5b0a5c7c.jpg,بضعة أشخاص يجلسون على حافة تطل على الشاطئ,كام واحد قاعدين على حافة بتطل على الشاطئ,شوية ناس كيقعدوا ف حافة كتشوف الشاطئ
36,36,1052358063_eae6744153.jpg,يقوم الطفل بأداء خدعة لوح التزلج بينما يميل طفل آخر يحمل لوح تزلج على الحائط,طفل بيعمل حيلة على لوح التزلج و طفل تاني ماسك لوح تزلج متكئ على الحيط,وليد كيدير خدعة ديال لوح التزلج و وليد أخر كيحمل لوح التزلج على الحيط
37,37,105342180_4d4a40b47f.jpg,فتاة تتجول في نهر كبير,بنت ماشية في نهر كبير,بنت كتمشي ف نهر كبير
38,38,1053804096_ad278b25f1.jpg,فتاة تلعب في الأمواج,بنت بتلعب في الأمواج,بنت كتلعب ف الأمواج
39,39,1055623002_8195a43714.jpg,مجموعة من الأطفال يتعاركون بالوسادات,مجموعة أطفال بيتخانقوا بالمخاد,مجموعة ديال ولاد كيتعاركو بالوسادات
40,40,1055753357_4fa3d8d693.jpg,اثنين من عمال البناء يأخذون استراحة,اتنين عمال بناء بياخدوا بريك,جوج عمال ديال البناء كياخدو راحة
41,41,1056249424_ef2a2e041c.jpg,يلعب الأطفال في الماء,أطفال بيلعبوا في الماية,ولاد كيلعبوا ف الماء
42,42,1056338697_4f7d7ce270.jpg,امرأة شقراء في قميص أزرق تنتظر رحلة,ست شقرا لابسة قميص أزرق مستنية رحلة,امراة شقراء ف قميص أزرق كتنظر رحلة
43,43,1056359656_662cee0814.jpg,فتاة صغيرة تنظر في كتيب عن ركوب القطار,بنت صغيرة بتبص في كتيب عن ركوب القطار,بنت صغيرة كتشوف ف كتيب عن ركوب القطار
44,44,1056873310_49c665eb22.jpg,كلب أسود يركض خلف كلب أسود على شاطئ صخري,كلب أسود بيجري ورا كلب أسود على شاطئ صخري,كلب أسود كيجري ورا كلب أسود على شاطئ صخري
45,45,1057089366_ca83da0877.jpg,صبي ينزل عن لوح الغطس العالي,ولد بينزل من لوح الغطس العالي,وليد كينزل من لوح الغطس العالي
46,46,1057210460_09c6f4c6c1.jpg,رجل يقف بجانب نافذة يخلع قميصه,راجل واقف جنب شباك بيقلع قميصه,راجل واقف حدا نافذة كيحل قميصه
47,47,1057251835_6ded4ada9c.jpg,كلب خفيف اللون يركض على الشاطئ,كلب فاتح اللون بيجري على الشاطئ,كلب فاتح اللون كيجري ف الشاطئ
48,48,106490881_5a2dd9b7bd.jpg,صبي في ملابس السباحة الزرقاء على الشاطئ,ولد لابس لبس سباحة أزرق على الشاطئ,وليد ف ملابس السباحة زرقاء ف الشاطئ
49,49,106514190_bae200f463.jpg,مسافر يقف على قمة تطل على الجبال أدناه,"مسافر واقف على قمة بتطل على الجبال 
"," مسافر واقف ف قمة كتشوف الجبال 
"
50,50,1067180831_a59dc64344.jpg,كلب أبيض وأسود يقفز وراء لعبة صفراء,كلب أبيض وأسود بيقفز ورا لعبة صفرا,كلب أبيض و أسود كيطلع و ينزل فوق لعابة صفراء
51,51,1067675215_7336a694d6.jpg,رجل يرتدي سراويل زرقاء اللون في الشارع,راجل لابس بنطلون أزرق في الشارع,راجل لابس سروال أزرق في الشارع
52,52,1067790824_f3cc97239b.jpg,كلب أبيض وأسود وكلب بني في الرمل,كلب أبيض وأسود وكلب بني في الرمل,كلب أبيض و أسود و كلب بني في الرمال
53,53,1072153132_53d2bb1b60.jpg,كلب أبيض وأسود يمسك لعبة في الجو,كلب أبيض وأسود ماسك لعبة في الجو,كلب أبيض و أسود ماسك لعابة في الهواء
54,54,107318069_e9f2ef32de.jpg,حشد يشاهد بالونات الهواء في الليل,جمهور بيشوف بالونات الهوا في الليل,جمع من الناس كيشوفو البالونات في الليل
55,55,1075716537_62105738b4.jpg,طفل مع خوذة على رأسه يركب دراجة,طفل مع خوذة على راسه بيركب دراجة,وليد مع خوذة على راسو كيركب دراجة
56,56,107582366_d86f2d3347.jpg,تجمع مجموعة من الناس في الظلام,مجموعة من الناس متجمعة في الظلام,جمع من الناس كيتجمعو في الظلام
57,57,1075867198_27ca2e7efe.jpg,رجل في قميص بني وشورت غامق يلعب على الشاطئ مع اثنين من الكلاب السوداء,راجل في قميص بني وشورت غامق بيلعب على الشاطئ مع اتنين كلاب سود,راجل لابس قميص بني و شورت غامق كيلعب على الشاطئ مع جوج كلاب سود
58,58,1075881101_d55c46bece.jpg,صبي ينظف الفقاعات من وجهه,ولاد بيغسل الفقاعات من وشه,وليد كيغسل الفقاعات من وجهو
59,59,1077546505_a4f6c4daa9.jpg,ينزلق صبي في شورت أزرق إلى أسفل في بركة,ولاد بيلزق في شورت أزرق لتحت في بركة,وليد كينزل في بركة لابس شورت أزرق
60,60,1077931201_1e0bb83105.jpg,رجل في الماء يرمي صبيًا صغيرًا في الهواء وينتظر أن ينزل حتى يتمكن من الإمساك به,راجل في المية بيرمي ولاد صغير في الهوا وبيستنى ينزل عشان يمسكه,راجل في الماء كيرمي وليد صغير في الهواء و كيستنا حتى ينزل باش يمسكو
61,61,1079274291_9aaf896cc1.jpg,صبي صغير يخرج لسانه من أجل الكاميرا,ولاد صغير بيطلع لسانه للكاميرا,وليد صغير كيطلع لسانو للكاميرا
62,62,10815824_2997e03d76.jpg,حصان أشقر وفتاة شقراء في قميص أسود يحدقان في نار في برميل,حصان أشقر وبنت شقرا في قميص أسود بيحدقوا في نار في برميل,فرس أشقر و بنت شقراء لابسة قميص أسود كيتفرجو على نار في برميل
63,63,1082252566_8c79beef93.jpg,كلب نحيف كبير يقف بالقرب من كلبين أصغر حجما,كلب نحيف كبير واقف جنب اتنين كلاب أصغر,كلب كبير رقيق واقف قريب من جوج كلاب صغار
64,64,1082379191_ec1e53f996.jpg,سيدة ورجل بدون قميص يجلسان على منصة,ست وراجل من غير قميص قاعدين على منصة,سيدة و راجل بلا قميص كيقعدو على منصة
65,65,1084040636_97d9633581.jpg,كلب أبيض كبير ملقى على الأرض,كلب أبيض كبير نايم على الأرض,كلب أبيض كبير ملقى على الأرض
66,66,1084104085_3b06223afe.jpg,امرأة في شورت أزرق وقميص أبيض تتسلق الصخور في مكان مغلق,ست في شورت أزرق وقميص أبيض بتسلق الصخور في مكان مغلق,مرا لابسة شورت أزرق و قميص أبيض كطلع في الصخور في بلاصة مغلوقة
67,67,1087168168_70280d024a.jpg,صبي يقفز في الماء,ولاد بيقفز في المية,وليد كيطلع في الماء
68,68,1087539207_9f77ab3aaf.jpg,عائلة تلعب على جرار في يوم جميل,عيلة بتلعب على جرار في يوم جميل,عائلة كتلعب على جرار في يوم جميل
69,69,1088767354_2acee738cf.jpg,امرأة في زي أحمر,ست في لبس أحمر,مرا لابسة لباس أحمر
70,70,108898978_7713be88fc.jpg,رجلان يتزلجان في الثلج في منطقة حرجية,اتنين رجالة بيتزلجوا في الثلج في منطقة حرجية,جوج رجال كينزلو في الثلج في غابة
71,71,108899015_bf36131a57.jpg,متسلق وحيد يشق طريقه فوق الجبل,متسلق لوحده بيشق طريقه فوق الجبل,متسلق وحيد كيطلع على الجبل
72,72,1089181217_ee1167f7af.jpg,كلب بني يهرول في طريق ممهد,كلب بني بيجرى في طريق ممهد,كلب بني كيجري في طريق ممهد
73,73,1089755335_0bfbfd30e6.jpg,الأم والطفل يصطادان على الممر في الليل,الأم والطفل بيصطادوا على الممر في الليل,الأم و وليد كيتصايدو في الليل
74,74,109202756_b97fcdc62c.jpg,امرأة ترتدي سترة زرقاء وجينز أزرق تركب حصانًا بنيًا بالقرب من بحيرة متجمدة وجبل مغطى بالثلج,ست لابسة جاكيت أزرق وجينز أزرق راكبة حصان بني جنب بحيرة متجمدة وجبل مغطى بالثلج,مرا لابسة جاكيت أزرق و جينز أزرق كتركب فرس بني قريب من بحيرة متجمدة و جبل مغطي بالثلج
75,75,109202801_c6381eef15.jpg,اثنين من الخيول تسحب عربة عبر الثلج,اتنين خيول بيسحبوا عربية عبر الثلج,جوج خيول كيسحبو عربة في الثلج
76,76,109260216_85b0be5378.jpg,شخص يتسلق صخرة باستخدام حبل,واحد بيتسلق صخرة باستخدام حبل,شخص كيطلع على صخرة باستعمال حبل
77,77,109260218_fca831f933.jpg,يقف الناس داخل قبة صخرية,ناس واقفة جوه قبة صخرية,الناس واقفين في قبة صخرية
78,78,1093716555_801aacef79.jpg,مجموعة من الرحالة تكمن على الأرض الجافة,مجموعة من الرحالة نايمة على الأرض الجافة,جمع من الرحالة كيقعدو على الأرض الجافة
79,79,1093737381_b313cd49ff.jpg,امرأة ترتدي ثوبًا أزرق اللون تقف مع صورة طباشيرية لطفلين يلعبان في نهر,ست لابسة فستان أزرق واقفة مع صورة طباشيرية لولاد بيلعبوا في نهر,مرا لابسة لباس أزرق واقفة مع صورة طباشيرية لوليدين كيلعبو في نهر
80,80,1094462889_f9966dafa6.jpg,كلب بني يلعب في كومة من الثلج العميقة,كلب بني بيلعب في كومة من الثلج العميقة,كلب بني كيلعب في كومة من الثلج
81,81,1095476286_87d4f8664e.jpg,صبي يقفز في نافورة,ولاد بيقفز في نافورة,وليد كيطلع في نافورة
82,82,1095580424_76f0aa8a3e.jpg,كلب يخرج من نفق,كلب بيخرج من نفق,كلب كيطلع من نفق
83,83,1095590286_c654f7e5a9.jpg,كلب يطارد كلب آخر,كلب بيطارد كلب تاني,كلب كيجري ورا كلب آخر
84,84,1095980313_3c94799968.jpg,فتاة صغيرة في ملابس السباحة الزرقاء تمشي على طول سياج خشبي بجوار شاطئ رملي,بنت صغيرة في لبس البحر الأزرق ماشية على طول سور خشبي جنب شاطئ رملي,بنت صغيرة لابسة ملابس سباحة زرقاء كتمشي على طول سياج خشبي قريب من شاطئ رملي
85,85,1096097967_ac305887b4.jpg,كلب أبيض وأسود يشرب الماء,كلب أبيض وأسود بيشرب مية,كلب أبيض و أسود كيشرب الماء
86,86,1096165011_cc5eb16aa6.jpg,صبي يبتسم تحت الماء,ولاد بيبتسم تحت المية,وليد كيبسم تحت الماء
87,87,1096395242_fc69f0ae5a.jpg,صبي مع بندقية لعبة,ولاد مع بندقية لعبة,وليد مع بندقية لعبة
88,88,109671650_f7bbc297fa.jpg,صبي يرتدي الأزرق والأصفر يسير على حافة منحدر,ولاد لابس أزرق وأصفر ماشي على حافة منحدر,وليد لابس الأزرق و الأصفر كيمشي على حافة منحدر
89,89,109738763_90541ef30d.jpg,شخص على عربة الثلج في منتصف القفزة,واحد على عربة الثلج في نص القفزة,شخص على عربة الثلج في وسط القفزة
90,90,109738916_236dc456ac.jpg,الناس يركبون على عربات الثلوج,ناس راكبة على عربات الثلج,الناس كيركبو على عربات الثلج
91,91,109823394_83fcb735e1.jpg,ثلاثة أشخاص يقودون مركبات رباعية الدفع,تلاتة أشخاص بيقودوا مركبات رباعية الدفع,ثلاثة أشخاص كيقودو مركبات رباعية الدفع
92,92,109823395_6fb423a90f.jpg,مركبة بأربع دواليب تقفز في حقل فارغ,مركبة بأربع دواليب بتقفز في حقل فاضي,مركبة بأربع دواليب كطلع في حقل فارغ
93,93,109823397_e35154645f.jpg,رجل يقفز في الهواء أثناء ركوب مركبة,راجل بيقفز في الهوا وهو راكب مركبة,راجل كيطلع في الهواء وهو كيركب مركبة
94,94,1100214449_d10861e633.jpg,صبي في قميص مقلم يقفز أمام نافورة ماء,ولاد في قميص مخطط بيقفز قدام نافورة مية,وليد لابس قميص مقلم كيطلع قدام نافورة ماء
95,95,1104133405_c04a00707f.jpg,صبي يحمل كرة قدم,ولاد شايل كرة قدم,وليد حامل كرة قدم
96,96,1105959054_9c3a738096.jpg,طفل يرسم صورة,طفل بيرسم صورة,وليد كيرسم صورة
97,97,110595925_f3395c8bd6.jpg,يقود راكب الدراجة دراجة على طريق,راكب الدراجة بيقود دراجة على طريق,راكب الدراجة كيركب دراجة على طريق
98,98,1107246521_d16a476380.jpg,كلب أسود يقفز للقبض على لعبة حبل,كلب أسود بيقفز عشان يمسك لعبة حبل,كلب أسود كيطلع باش يمسك لعابة حبل
99,99,1107471216_4336c9b328.jpg,فتاة صغيرة تمسك بكاميرا سينمائية,"بنت صغيرة ماسكة كاميرا سينمائية 
"," بنت صغيرة ماسكة كاميرا سينمائية
"
100,100,1110208841_5bb6806afe.jpg,كلب أبيض وبني يمسك بالفريسبي في فمه أمام مجموعة من الناس,كلب أبيض وبني ماسك الفريسبي ببوقه قدام مجموعة ناس,كلب أبيض و بني كيحمل فريسبي ف فمه قدام واحد جماعة ديال ناس
101,101,1112212364_0c48235fc2.jpg,طفل يرص الصخور على الشاطئ,طفل بيرص الحجارة على الشط,واحد ولد صغير كيحط الحجارة فوق بعضهم ف البحر
102,102,111497985_38e9f88856.jpg,شاب يتسلق تلة صخرية,شاب بيتسلق تل صخري,واحد شاب كيطلع واحد الجبل ديال الحجارة
103,103,111537217_082a4ba060.jpg,رجل يتسلق جدار صخري,راجل بيتسلق حيط صخري,واحد راجل كيطلع واحد الحيط ديال الحجارة
104,104,111537222_07e56d5a30.jpg,رجل يصعد جدار صخري,راجل بيطلع حيط صخري,واحد راجل كيطلع واحد الحيط ديال الحجارة
105,105,1115565519_d976d4b1f1.jpg,طفل يلعب مع نافورة على الشاطئ,طفل بيلعب مع نافورة على الشط,واحد ولد صغير كيلعب مع واحد النافورة ف البحر
106,106,1115679311_245eff2f4b.jpg,كلب أسود يقفز فوق حائط على الشاطئ,كلب أسود بيقفز فوق حيط على الشط,كلب أسود كيتسلق واحد الحيط ف البحر
107,107,111766423_4522d36e56.jpg,عصفور أبيض وأسود يأكل من يد شخص ما,عصفور أبيض وأسود بياكل من إيد حد,واحد طير أبيض و أسود كياكل من يد واحد شخص
108,108,1117972841_2b9261f95f.jpg,كلب بني يركض في الرمال,كلب بني بيجري في الرمال,كلب بني كيجري ف الرمال
109,109,1118557877_736f339752.jpg,صبي صغير يقف في الأمواج,ولاد صغير واقف في الموجه,واحد ولد صغير واقف ف الموج
110,110,1119015538_e8e796281e.jpg,كلب مرعب يركض عبر العشب,كلب مرعب بيجري في العشب,كلب مخيف كيجري ف العشب
111,111,1119418776_58e4b93eac.jpg,كلب أسود وبني وأبيض يركض في حقل,كلب أسود وبني وأبيض بيجري في الحقل,كلب أسود و بني و أبيض كيجري ف واحد الحقل
112,112,1119463452_69d4eecd08.jpg,فتاة تسبح في بركة,بنت بتسبح في بركة,واحدة بنت كسبح ف واحد البسين
113,113,1121416483_c7902d0d49.jpg,طفل يقف على رأسه,طفل واقف على راسه,واحد ولد صغير واقف على راسو
114,114,112178718_87270d9b4d.jpg,رجل يقف في الرمال مع لوح التزلج خلفه,راجل واقف في الرمال ومعاه لوح تزلج وراه,واحد راجل واقف ف الرمال مع واحد لوح التزلج وراهو وراه
115,115,112243673_fd68255217.jpg,يتجول ثلاثة أشخاص على دراجات,تلاتة أشخاص بيتمشوا على دراجات,ثلاثة ديال الناس كيدورو على دراجات
116,116,1122944218_8eb3607403.jpg,يحمل الطفل علم أسود صغير عليه قمر ونجم,الطفل شايل علم أسود صغير عليه قمر ونجمة,واحد ولد صغير كيحمل واحد علم صغير أسود عليه قمر و نجمة
