image_number,image_number,image,text,egyptian,Moroccan
453,453,1433142189_cda8652603.jpg,مسافر يسير على طريق بلا عوائق فوق تلة,مسافر ماشي على طريق مفرود فوق تل,مسافر ماشي فطريق بلا عوائق فوق تلة
454,454,1433397131_8634fa6664.jpg,طفل مخفي بواسطة الكرات,طفل مخبي وراه الكرات,وليد مخبي ب الكرات
455,455,1433577867_39a1510c43.jpg,كلب أبيض في الماء,كلب أبيض في الميه,كلب أبيض ف الماء
456,456,1434005938_ad75c8598c.jpg,رجل يحمل حقيبة كبيرة ويبحث عن بعض الحقول الخضراء,راجل شايل شنطة كبيرة و بيدور على شويه حقول خضرا,راجل شاد شنتة كبيرة و كيبحث على بعض الحقول الخضراء
457,457,1434607942_da5432c28c.jpg,طفل يركب على أكتاف الرجل,طفل راكب على كتاف الراجل,وليد راكب على كتاف راجل
458,458,143552697_af27e9acf5.jpg,رجل يركب دراجته على تلة,راجل راكب عجلته على تل,راجل راكب دراجتو فوق تلة
459,459,143552829_72b6ba49d4.jpg,رجل على دراجة نارية يسوق عبر تضاريس المستنقعات,راجل على موتوسيكل بيسوق في أرض مستنقعات,راجل على دراجة نارية كيسوق عبر تضاريس المستنقعات
460,460,1436760519_8d6101a0ed.jpg,كلب أبيض وأسود يقفز للقبض على لعبة كما يشاهد كلب آخر,كلب أبيض و أسود بيقفز علشان يمسك لعبة و كلب تاني بيتفرج,كلب أبيض و أسود كيفرز باش يمسك لعبة و كيشوف كلب آخر
461,461,143680442_2f03f76944.jpg,رجل يتدلى من جرف صخري بينما تسلق الصخور فوق,راجل متدلي من حافة صخرية و في ناس بتسلق فوق,راجل معلق من جرف صخري بينما كيتسلق الصخور فوق
462,462,143680966_0010ff8c60.jpg,رجل يرتدي حقيبة ظهر و يتسلق صخرة,راجل لابس شنطة ظهر و بيتسلق صخرة,راجل لابس حقيبة ظهر و كيتسلق صخرة
463,463,143684568_3c59299bae.jpg,رجل يقف على جرف,راجل واقف على حافة صخرية,راجل واقف على جرف
464,464,143688205_630813a466.jpg,يتسلق متسلق وجه صخري حاد,متسلق بيتسلق وجه صخرة حاد,كيتسلق متسلق وجه صخري حاد
465,465,143688283_a96ded20f1.jpg,رجل يرتدي قميصا أبيض وخوذة يتسلق جبلًا,راجل لابس قميص أبيض و خوذة بيتسلق جبل,راجل لابس قميص أبيض و خوذة كيتسلق جبل
466,466,143688895_e837c3bc76.jpg,متسلق يقف على وجه الصخرة بجانب الحبل الوردي,متسلق واقف على وجه الصخرة جنب حبل وردي,متسلق واقف على وجه الصخرة بجانب الحبل الوردي
467,467,1439046601_cf110a75a7.jpg,صبي يبتسم وهو يقف أمام حمام السباحة,ولد بيضحك و هو واقف قدام حمام السباحة,وليد كيبسم و هو واقف قدام حمام سباحة
468,468,1439282131_3814d6ae04.jpg,الكلبان في الماء يستردان عصا,الكلاب في الميه بياخدوا عصا,الكلبين ف الماء كيجمعو عصا
469,469,1440024115_129212c988.jpg,رجل يلعب الفريسبي مع كلبه,راجل بيلعب فريسبي مع كلبه,راجل كيلعب الفريسبي مع كلبتو
470,470,1443807993_aebfb2784a.jpg,فتاة تنزل في منزلقة,بنت نازلة في زحليقة,بنت نازلة ف منزلق
471,471,1445123245_c7b9db0e0c.jpg,كلب أسود وتأن يلعب مع لعبة حريش,كلب أسود و بتاع نباح بيلعب مع لعبة حريش,كلب أسود و كيتأوه كيلعب مع لعبة حريش
472,472,1445754124_647168f211.jpg,كلب أبيض وأسود يتسلق جذع شجرة مائل,كلب أبيض و أسود بيتسلق جذع شجرة مائل,كلب أبيض و أسود كيتسلق جذع شجرة مائل
473,473,1446053356_a924b4893f.jpg,لاعب كرة القدم الشاب يتمتع باللعبة,لاعب كورة قدم صغير بيستمتع باللعبة,لاعب كرة القدم الشاب كيستمتع باللعبة
474,474,1446933195_8fe9725d62.jpg,جرو أسود عض طرف شجرة,جرو أسود عض طرف شجرة,جرو أسود عض طرف شجرة
475,475,1448511770_1a4a9c453b.jpg,كلب أبيض يمسك بالقرص الطائر في بركة,كلب أبيض ماسك بالقرص الطائر في بركة,كلب أبيض كيمسك بالقرص الطائر ف بركة
476,476,1449370354_380c4123c9.jpg,أطفال يركضون على العشب,أطفال بيجرى على العشب,وليدات كيجريو على العشب
477,477,1449625950_fc9a8d02d9.jpg,اثنين من الكلاب يلعبان معا في العشب,اتنين كلاب بيلعبوا مع بعض في العشب,جوج كلاب كيلعبو مع بعض ف العشب
478,478,1449692616_60507875fb.jpg,فتاة تلتقط صورة بيدها فوق عدسة الكاميرا,بنت بتصور بصبعها فوق عدسة الكاميرا,بنت كتصور بيدها فوق عدسة الكاميرا
479,479,1452361926_6d8c535e32.jpg,صبي يجلس في سيارة لعبة أثناء الشرب من كوب سيبي,ولد قاعد في عربية لعبة و بيشرب من كوب سيبي,وليد قاعد ف سيارة لعبة و كيشرب من كوب سيبي
480,480,1453366750_6e8cf601bf.jpg, طفلان رأسا على عقب, اتنين أطفال راسهم على الأرض,جوج ولاد رأس على عقب
481,481,1454678644_7e5a371301.jpg,تتقاتل ثلاثة كلاب من أجل لعبة مضغ أخضر على ممشى من الحجر,تلات كلاب بيتخانقوا على لعبة مضغ خضرا على ممشى من الحجر,تلاتة كلاب كيتقاتلو على لعبة مضغ خضراء على ممشى من الحجر
482,482,1454841725_4b6e6199e2.jpg,مجموعة من الفتيات يبتسمن مع حشد كبير خلفهن,مجموعة من البنات بيضحكوا و وراهم زحمة كبيرة,مجموعة من البنات كيبسمو مع حشد كبير وراهم
483,483,1456393634_74022d9056.jpg,صبي يقوم بالوقوف على اليدين على الشاطئ,ولد بيعمل وقوف على الإيد على الشاطئ,وليد كيقوم بالوقوف على اليدين على الشاطئ
484,484,1456630952_dd4778a48f.jpg,صبي يصطاد الفريسبي البرتقالي أمام بوابة خشبية,ولد بيلعب فريسبي برتقالي قدام باب خشبي,وليد كيجيب الفريسبي البرتقالي قدام بوابة خشبية
485,485,145721496_687af9bb18.jpg,طائر يقف على صخرة تطل على شلال,عصفور واقف على صخرة بتطل على شلال,طائر واقف على صخرة كتشوف شلال
486,486,145721498_a27d2db576.jpg,رجل في زورق أزرق يقاتل من خلال الأمواج العسيرة,راجل في قارب أزرق بيحارب في موجات صعبة,راجل ف زورق أزرق كيحارب من خلال الأمواج العسيرة
487,487,1457762320_7fe121b285.jpg,مجموعة من راكبي الدراجات يستعدون لركوب,مجموعة من راكبي الدراجات مستعدين للركوب,مجموعة من راكبي الدراجات كيستعدو لركوب
488,488,1459032057_97e73ed6ab.jpg,فتاة في قميص مخطط تتناول كعكة,بنت في قميص مخطط بتاكل كيك,بنت ف قميص مخطط كتاكل كعكة
489,489,1459250022_bf1eddad11.jpg,فرقة من التشيلو والكمانين يلعبان أمام حشد في معرض السوق,فرقة من التشيلو و الكمانين بيلعبوا قدام زحمة في معرض السوق,فرقة من التشيلو والكمانين كيلعبو قدام حشد ف معرض السوق
490,490,1460352062_d64fb633e0.jpg,فتاة بالنظارات الشمسية تجلس في فروع شجرة,بنت بلبس نظارة شمسية قاعدة في أغصان شجرة,بنت بالنظارات الشمسية قاعدة ف فروع شجرة
491,491,1460500597_866fa0c6f3.jpg,رجل يجلس في غرفة مكونة من ألواح خشبية,راجل قاعد في غرفة مصنوعة من ألواح خشبية,راجل قاعد ف غرفة مكونة من ألواح خشبية
492,492,146098876_0d99d7fb98.jpg,أربعة أطفال يرتدون الزي العسكري يقفون أمام أشجار النخيل,أربعة أطفال لابسين لبس عسكري واقفين قدام أشجار نخيل,أربعة ولاد لابسين الزي العسكري واقفين قدام أشجار النخيل
493,493,146100443_906d87faa2.jpg,فتاة وصبيين يرتدون ملابس لعيد القديسين,بنت و اتنين ولاد لابسين لبس عيد القديسين,بنت و جوج ولاد لابسين ملابس لعيد القديسين
494,494,1461329041_c623b06e5b.jpg,امرأتان على مركبات ذات ثلاث عجلات ذات سلال منخفضة,اتنين ستات على عربيات تلات عجلات فيها سلال منخفضة,جوج نساء على مركبات ذات ثلاث عجلات ذات سلال منخفضة
495,495,1461653394_8ab96aae63.jpg,كلب أبيض كبير ينظر الى كلب أسود كبير,كلب أبيض كبير بيبص على كلب أسود كبير,كلب أبيض كبير كيشوف ل كلب أسود كبير
496,496,1461667284_041c8a2475.jpg,يلعب عازف الجيتار في حين يلعب الناس مع الأطواق في الخلفية,عازف جيتار بيلعب و في ناس بيلعبوا مع حلقات في الخلفية,كيلعب عازف الجيتار و الناس كيلعبو مع الأطواق ف الخلفية
497,497,1463638541_c02cfa04dc.jpg,فتاة تتسلق حائط حبل,بنت بتسلق حيطان حبل,بنت كيتسلق حائط حبل
498,498,1463732130_a754441289.jpg,فتاة في قميص أبيض تقفز على الترامبولين,بنت في قميص أبيض بتقفز على الترامبولين,بنت ف قميص أبيض كتقفز على الترامبولين
499,499,1463732807_0cdf4f22c7.jpg,صبي على ملعب أرجوحة يضرب وضعية توسطية,"ولد على ملعب أرجوحة بيعمل وضعية وسطية 
"," وليد على ملعب أرجوحة كيدير وضعية توسطية
"
500,500,1464120327_d90279ca3a.jpg,صبي صغير يضغط على وجهه نافذة,ولاد صغير بيضغط على وشه على الشباك,وليد صغير كيدير ضغط بوجهو على النافذة
501,501,1465666502_de289b3b9c.jpg,كلب أسود يسبح في الماء الأخضر مع شيء في فمه,كلب اسود بيسبح في المية الخضرا ومعاه حاجة في بقه,كلاب أسود كايسباح في الماء الأخضر ومعاه شي حاجة في فمو
502,502,146577645_91b570c0d0.jpg,يمر راكب القارب بالموجات التي تمسك بمجدافته,راكب القارب بيعدي من على الموج و ماسك المجاديف,راكب القارب كايمشي مع الموجات وكايمسك في مجاديفو
503,503,146577646_9e64b8c2dc.jpg,رجل يتجول في منحدرات المياه البيضاء,راجل ماشي في شلالات المية البيضا,راجل كايتمشى في منحدرات الماء البيضاء
504,504,1466307485_5e6743332e.jpg,رجل في سترة برتقالية يميل فوق شاحنة صغيرة,راجل لابس جاكيت برتقالي و ميل على شاحنة صغيرة,راجل لابس جاكيت برتقالية كايميل فوق شاحنة صغيرة
505,505,1466307489_cb8a74de09.jpg,رجال يرتدون الخوذات وسترة برتقالية يسحبون سيارة جيب من خندق,رجالة لابسين خوذات و جواكت برتقالي بيسحبوا جيب من خندق,رجال لابسين خوذات وجاكيتات برتقالية كايسحبو سيارة جيب من خندق
506,506,1466479163_439db855af.jpg,كلب بني يركض عبر العشب ممسكا بشيء في فمه,كلب بني بيجري في العشب و ماسك حاجة في بقه,كلاب بني كايكرّي في العشب ومعاه شي حاجة في فمو
507,507,1467533293_a2656cc000.jpg,تلعب الفتاتان في صالة ألعاب الأدغال الصفراء والحمراء,بنات بيلعبوا في ملعب ادغال اصفر و احمر,بنات صغار كايلعبو في صالة ألعاب الأدغال الصفراء والحمراء
508,508,1468103286_96a6e07029.jpg,لاعب البيسبول في زي يانكيز يمسك بمضرب في يد واحدة,لاعب بيسبول لابس لبس يانكيز ماسك المضرب في ايده,لاعب بيسبول لابس زي يانكيز كايمسك في مضرب بيد واحدة
509,509,1468389504_c724bdcad0.jpg,تلعب فتاتان باللون الوردي على قضبان الملعب الصفراء,بنات لابسين وردي بيلعبوا على قضبان الملعب الصفرا,بنات صغار لابسين اللون الوردي كايلعبو في قضبان الملعب الصفراء
510,510,1468429623_f001988691.jpg,كلب أسود يقفز يقضم ذراع رجل مبطنة,كلب اسود بيقفز و بيعض دراع راجل مبطنة,كلاب أسود كايكرّي وكاتعض ذراع راجل مبطنة
511,511,1468962616_5803b4397f.jpg,طفل يلعب بسلاح الماء في بركة,طفل بيلعب بمسدس مية في بركة,وليد صغير كايلعب بسلاح الماء في بركة
512,512,1469000260_5d473c8283.jpg,كلب تان كبير يستلقي على الأرض ينظر إلى الجانب,كلب تان كبير نايم على الارض و بيبص على جنب,كلاب تان كبير كايتمدد في الأرض وكايبغى على جنبو
513,513,1469358746_2a879abaf3.jpg,رجل وكلبه في الجبال,راجل و كلبه في الجبال,راجل و كلابو في الجبال
514,514,1470061031_4cb59c12a8.jpg,اثنين من الكلاب البني يقاتلون,اتنين كلاب بني بيحاربوا,جوج كلاب بني كايتقاتلو
515,515,1470132731_fa416b7504.jpg,كلب أسود يعمل في الماء,كلب اسود بيشتغل في المية,كلاب أسود كايتمشى في الماء
516,516,1470536919_1f3fd6c65a.jpg,كلب أسود صغير يركض بجانب كلب ثلاثي اللون أكبر يحمل لعبة حبل في فمه,كلب اسود صغير بيجري جنب كلب ثلاثي اللون اكبر و شايل لعبة حبل في بقه,كلاب أسود صغير كايكرّي جنب كلاب ثلاثي اللون أكبر ومعاه لعبة حبل في فمو
517,517,1472053993_bed67a3ba7.jpg,رجل في البرتقالي يتزلج أسفل التلال المغطاة بالثلوج,راجل لابس برتقالي بيتزلج من على التلال اللي مغطية بالثلج,راجل لابس برتقالية كايتزلج أسفل التلال المغطاة بالثلوج
518,518,1472230829_803818a383.jpg,مجموعة من الناس في قارب  تجمع مياه بيضاء, مجموعة من الناس في قارب بيجمعوا مية بيضا,جموعة من الناس في قارب كايتجمعو الماء الأبيض
519,519,1472249944_d887c3aeda.jpg,فتاة تتمرن على صخرة بينما تقف أخرى بجانبها,بنت بتتمرن على صخرة و وحدة واقفة جنبها,بنت كايتمرّن على صخرة وبنت أخرى واقفة بجنبها
520,520,1472653060_7427d2865a.jpg,رجل يقطع بعض الطعام على لوح أصفر,راجل بيقطع بعض الاكل على لوح اصفر,راجل كايتقطع شي طعام على لوح أصفر
521,521,1472882567_33dc14c8b6.jpg,مجموعة من المتزلجين يصعدون الجبل,مجموعة من المتزلجين بيطلعوا الجبل,جموعة من المتزلجين كايتسلقو الجبل
522,522,1473080948_bae2925dc8.jpg,رجل يركب قاربه عبر منحدرات,راجل راكب قاربه و بيعدي من على شلالات,راجل كايمشي بقاربو عبر منحدرات
523,523,1473250020_dc829a090f.jpg,رجل يقف بالحجارة والماء ويمسك عصا,راجل واقف عند الحجارة و المية و ماسك عصاية,راجل واقف على الحجارة والماء و كايمسك في عصا
524,524,1473618073_7db56a5237.jpg,صبي على أرجوحة بلاستيكية خضراء,ولاد على ارجوحة بلاستيك خضرا,وليد صغير على أرجوحة بلاستيكية خضراء
525,525,1474474514_b3eb492722.jpg,طفل يبتسم في حديقة,طفل بيبتسم في حديقة,وليد صغير كايبغى في حديقة
526,526,1475046848_831245fc64.jpg,امرأة شابة ذات شورت أزرق تمشي على الشاطئ وتحمل حذائها,ست شابة لابسة شورت ازرق ماشية على الشاطئ و شايلة جزمتها,امرأة شابة لابسة شورت أزرق كايتمشى على الشاطئ وكاتحمل حذائها
527,527,1476002408_4256b7b2fa.jpg,شخص وحيد يرتدي لحافًا يسير على رصيف الشارع,شخص لوحده لابس لحاف ماشي على رصيف الشارع,شخص وحيد لابس لحاف كايتمشى على رصيف الشارع
528,528,1476241331_2f43b67aed.jpg,صبي وولد صغير يقفان بجانب نافورة ماء,ولاد و ولد صغير واقفين جنب نافورة مية,وليد و ولاد صغيرين واقفين جنب نافورة الماء
529,529,1478268555_7e301fc510.jpg,متسلق الصخور وحيد تسلق جدار صخري ضخم,متسلق صخور لوحده طالع جدار صخري كبير,متسلق صخور وحيد كايتسلق جدار صخري ضخم
530,530,1478294229_7e1c822fea.jpg,لقطة مقرّبة لراكب دراجة,صورة قريبة لراكب دراجة,صورة قريبة لراكب دراجة
531,531,1478606153_a7163bf899.jpg,كلب أبيض وبني يمر عبر الغابات,كلب ابيض و بني بيمشي في الغابة,كلاب أبيض وبني كايمشي عبر الغابات
532,532,1479028910_3dab3448c8.jpg,يقفز المتزلج في الملابس الرمادية فوق الحذاء أمام شقة,متزلج لابس رمادي بيقفز فوق الحذاء قدام شقة,متزلج لابس لباس رمادي كايكرّي فوق الحذاء أمام شقة
533,533,1479124077_17dcc0d5d7.jpg,صبي حافي القدمين في السروال وقميص تي شيرت يقفز في العشب الموحل,ولاد حافي رجليه لابس بنطلون و تيشرت بيقفز في العشب الموحل,وليد حافي القدمين لابس سروال وقميص تي شيرت كايكرّي في العشب الموحل
534,534,1479513774_70c94cf9d3.jpg,تقف فتاة ترتدي سترة خضراء على ضوء توقف,بنت لابسة جاكيت اخضر واقفة عند اشارة وقف,بنت لابسة جاكيت خضراء واقفة على ضوء توقف
535,535,1479679558_d0a01bc62b.jpg,يضيق الخور عبر الغابة,الخور ضيق و بيمشي في الغابة,الخور كايتضيق عبر الغابة
536,536,1479857177_9d4a6f38fd.jpg,رجل الغوص تحت الماء,راجل بيغوص تحت المية,راجل كايتغوص تحت الماء
537,537,1480712062_32a61ad4b7.jpg,غطاس تحت الماء تحت الماء يمسك بسرطان البحر صغير,غطاس تحت المية تحت المية و ماسك سرطان البحر صغير,غطاس تحت الماء كايمسك في سرطانات صغيرة
538,538,1481062342_d9e34366c4.jpg,فتاة صغيرة تدور في ردهة أرضية صلبة,بنت صغيرة بتلف في ردهة ارضية صلبة,بنت صغيرة كا تدور في ردهة أرضية صلبة
539,539,1482960952_95f2d419cb.jpg,ثلاث نساء مسنات يسيران من الخلف,تلات ستات كبار في السن ماشيين من ورا,ثلاث نساء مسنات كايتمشاو من الخلف
540,540,148512773_bae6901fd6.jpg,يتمتع الزوجان بلحظة هادئة بالقرب من النهر,الزوجين بيعيشوا لحظة هادية جنب النهر,زوجين كايتمتعو بلحظة هادئة قرب النهر
541,541,1488937076_5baa73fc2a.jpg,بعض الكلاب الملونة المختلفة تقفز في العشب خلف المنزل,بعض الكلاب الملونة المختلفة بتقفز في العشب ورا البيت,شوية كلاب ملونة مختلفة كايكرّيو في العشب خلف الدار
542,542,1489286545_8df476fa26.jpg,رجل وكلب يجلسان على مقعد قرب جسم من الماء,راجل و كلب قاعدين على كرسي جنب جسم من المية,راجل و كلاب كا يجلسو على مقعد قرب جسم من الماء
543,543,1490213660_9ea45550cf.jpg,كلب ذو لون فاتح يسير خلال مجرى مائي,كلب لونه فاتح بيمشي في مجرى مائي,كلاب بلون فاتح كايتمشى خلال مجرى مائي
544,544,1490670858_e122df2560.jpg,طفل على منزلقة حمراء,طفل على زحليقة حمرا,وليد صغير على منزلقة حمراء
545,545,1491192153_7c395991e5.jpg,رجل يضع فتى صغير يرتدي اللون البرتقالي في أرجوحة طفل,راجل بيحط ولد صغير لابس برتقالي في ارجوحة اطفال,راجل كا يضع ولد صغير لابس اللون البرتقالي في أرجوحة طفل
546,546,1499495021_d295ce577c.jpg,رجل وامرأة يصطادان السمك على الشاطئ,راجل و ست بيصطادوا سمك على الشاطئ,راجل و امرأة كا يصطادو السمك على الشاطئ
547,547,1499554025_a8ffe0e479.jpg,مجموعة من الناس تقف مع الماعز البيضاء,مجموعة من الناس واقفة مع غنم بيضا,جموعة من الناس واقفين مع ماعز بيضاء
548,548,1499581619_a5f65a882c.jpg,زوجان يرتديان سترات يقبلان بعضهما البعض على الشاطئ,زوجين لابسين جواكت بيبوسوا بعض على الشاطئ,زوجين لابسين جاكيتات كا يقبلو بعضهم البعض على الشاطئ
549,549,1500853305_0150615ce9.jpg,فتاة وفتى يتعانقان على جسر,"بنت و ولد بيتعانقوا على جسر 
"," بنت و ولد كا يتعانقو على جسر
"
550,550,1501297480_8db52c15b0.jpg,صبي يحاول وضع شاشة على نافذة,ولد بيحاول يحط شاشة على الشباك,واحد ولد كيحاول يوضع شاشة على نافذة
551,551,1501811302_5e723fc529.jpg,كلب الأغنام الأسود يطارد خروفًا رماديًا حول القلم,كلب الراعي الأسود بيطارد خروف رمادي حوالين القلم,كلب أسود ديال غنم كيطارد خروف رمادي حول القلم
552,552,1501985304_8c50093004.jpg,طفل يسبح مع امرأة,طفل بيسبح مع ست,ولد كيسباح مع مرا
553,553,150387174_24825cf871.jpg,رجل يرتدي تمويه يركب دراجة نارية,راجل لابس تمويه راكب موتور,واحد راجل لبس تمويه كيركب دراجة نارية
554,554,1505686764_9e3bcd854a.jpg,رجل يمشي على الصخور مع المياه المتدفقة من حوله,راجل ماشي على الصخور مع المياه بتنزل حواليه,واحد راجل كيمشي على الحجارة مع الماء كيتساقط حداو
555,555,150582765_bad8dec237.jpg,فتاة ترتدي سترة وردي تنظر من خلال كاميرتها,بنت لابسة جاكيت وردي بتبص من خلال الكاميرا بتاعتها,بنت لبسة سترة وردية كتنظر من خلال كاميرا ديالها
556,556,1507563902_6ec8d5d822.jpg,فتاة تقوم بخدعة على الترامبولين الأزرق وهي في الهواء,بنت بتعمل خدعة على الترامبولين الأزرق وهي في الهوا,بنت كتدير حيلة على الترامبولين الأزرق وهي في الهواء
557,557,1508269285_6c5723f67d.jpg,يقف كلب أبيض وأبيض في النهر بجانب البنك,كلب أبيض وأسود واقف في النهر جنب الضفة,كلب أبيض و أبيض واقف في النهر بجانب البنك
558,558,1509786421_f03158adfc.jpg,ولد يشير,ولد بيشاور,ولد كيشير
559,559,1510078253_96e9ec50e7.jpg,كلب يحاول اصطياد كرة,كلب بيحاول يمسك الكورة,كلب كيحاول يصطاد كرة
