image_number,image_number,image,text,egyptian,Moroccan
671,671,169490297_b6ff13632a.jpg,صبي في قميص أزرق وأصفر وبرتقالي يلعب في الخارج,ولد لابس قميص ازرق واصفر وبرتقالي بيلعب بره,وليد لابس قميص ازرق و اصفر و برتقالي كايلعب برا
672,672,170100272_d820db2199.jpg,طفل على منزلق,طفل على زلاقه,وليد في منزلق
673,673,1713248047_d03721456d.jpg,الكلاب الثلاثة في حقل,تلات كلاب في الحقل,ثلاث كلاب في حقل
674,674,1713248099_d860df4e10.jpg,كلب أبيض وأسود  كلب أصفر وكلب أسود في حقل عشبي,كلب ابيض واسود وكلب اصفر وكلب اسود في حقل عشبي,كلب ابيض و اسود كلب اصفر و كلب اسود في حقل عشبي
675,675,1714316707_8bbaa2a2ba.jpg,صبي في سترة حمراء يصفع شجرة مغطاة بالثلج بعصا,ولد لابس جاكيت احمر بيضرب شجرة مغطيه بالثلج بعصا,وليد لابس سترة حمراء كايدير شجرة مغطاة بالثلج بعصا
676,676,171488318_fb26af58e2.jpg,كلب يمشي على الشقق الطينية,كلب ماشي على شقق طينية,كلب كايمشي على الشقق الطينية
677,677,1716445442_9cf3528342.jpg,رجل يلتقط صخرة كبيرة,راجل بيلقط صخره كبيره,راجل كايتصيد صخرة كبيرة
678,678,1718184338_5968d88edb.jpg,الزوجان ينظران إلى أسفل النهر,الزوجين بيشوفوا تحت النهر,زوجين كايتفرجو لتحت النهر
679,679,172092461_a9a9762e13.jpg,شاب يركب لوح ركوب أمواج,شاب راكب لوح ركوب امواج,شاب كايركب لوح ركوب امواج
680,680,172092464_d9eb4f4f2f.jpg,رجل يتزلج على الماء خلف قارب,راجل بيتزلج على الميه ورا قارب,راجل كايتزلج على الماء ورا قارب
681,681,172097782_f0844ec317.jpg,رجل في جذوع السباحة وحملة تزلج نجاة حمراء,راجل في جذوع السباحة و شايل تزلج نجاة احمر,راجل في جذوع السباحة و حامل تزلج نجاة حمراء
682,682,172097783_292c5413d8.jpg,صبي يبحر على بحيرة بيد واحدة,ولد بيبحر على بحيرة بيد واحده,وليد كايبحر على بحيرة بيد واحدة
683,683,1721637099_93e9ec2a2f.jpg,صبي يرقد على الملابس,ولد نايم على هدومه,وليد كاينام على الملابس
684,684,17273391_55cfc7d3d4.jpg,صياد يصطاد على ضفة نهر ضبابي,صياد بيصطاد على ضفة نهر ضبابي,صياد كايتصيد على ضفة نهر ضبابي
685,685,173020287_230bfc4ffc.jpg,رجل يستعد لرمي العصا على كلبه المنتظر,راجل بيستعد يرمي العصاية على كلبه اللي مستني,راجل كايتحضر باش يدير العصا ل كلبوا اللي كايتسنى
686,686,1731546544_9fbf14617b.jpg,كلب أسود يقفز من خلال بعض الماء,كلب اسود بيقفز من خلال شويه ميه,كلب اسود كايتقافز من خلال الماء
687,687,1732217138_aa0199ef87.jpg,يأكل الزوجان وجبتهما في الخارج,الزوجين بياكلو اكلهم بره,زوجين كايكلو وجبتهم برا
688,688,1732436777_950bcdc9b8.jpg,زوجان على الدرج يصوران رجلا وامرأة يحتضنان أمام مبنى,زوجين على سلم بيصوروا راجل وست بيتعانقوا قدام مبنى,زوجين في درج كايديرو صورة لراجل و مرا كايتعانقو قدام بناية
689,689,174466741_329a52b2fe.jpg,طفل صغير في قميص وردي يمتد عبر حقل زهري,طفل صغير لابس قميص وردي بيمتد عبر حقل زهري,وليد صغير لابس قميص وردي كايمشي في حقل زهري
690,690,1745110280_0cbff5e273.jpg,كلب بني مع طوق أسود تقف بجانب بوش,كلب بني مع طوق اسود واقف جنب بوش,كلب بني مع طوق اسود واقف بجانب بوش
691,691,1752454466_723790dbd6.jpg,كلب أبيض وأبيض يخرج من منحدر أصفر وأزرق في منطقة عشبية,كلب ابيض و ابيض بيخرج من منحدر اصفر و ازرق في منطقة عشبية,كلب ابيض و ابيض كاخرج من منحدر اصفر و ازرق في منطقة عشبية
692,692,1763020597_d4cc8f0f8a.jpg,يستند الناس على الجدار,ناس متكئين على الحيط,ناس كايتسندو على الجدار
693,693,1764955991_5e53a28c87.jpg,كلب أبيض وأبيض يهرول على الطريق في الخريف,كلب ابيض و ابيض بيجري على الطريق في الخريف,كلب ابيض و ابيض كايسافق في الطريق في الخريف
694,694,1765164972_92dac06fa9.jpg,فتاة مع عصابة الأنف  حلق  و Mohawk,بنت مع عصابة الأنف و حلق و موهوك,فتاة مع عصابة الأنف  حلق  و Mohawk
695,695,1770036088_08abe4f6e9.jpg,رجل وفتاة في السرير,راجل و بنت في السرير,راجل و بنت في السرير
696,696,1771490732_0ab5f029ac.jpg,ثلاثة أولاد يلعبون كرة القدم في حقل,تلات اولاد بيلعبوا كورة قدم في حقل,ثلاث ولاد كايلعبو كرة القدم في حقل
697,697,1772859261_236c09b861.jpg,كلب أبيض وأسود يلعب في الماء,كلب ابيض و اسود بيلعب في الميه,كلب ابيض و اسود كايلعب في الماء
698,698,177302997_5b2d770a0a.jpg,طفل يركب حصانًا من البلاستيك في متنزه,طفل راكب حصان من البلاستيك في منتزه,وليد كايركب حصان من البلاستيك في متنزه
699,699,1773928579_5664a810dc.jpg,حشد يشاهد كلبًا يتسلق الدرج,"جمهور بيشوف كلب بيتسلق السلم 
"," حشد كايتفرج على كلب كايتسلق الدرج 
"
700,700,1775029934_e1e96038a8.jpg,حيوان مع قرون يقفز في حقل,حيوان بقرون بيقفز في الحقل,غزال بقرون كيحيد فالبحر  
701,701,1776981714_5b224d0f7a.jpg,امرأتان تمشيان في الشارع,ستين ستات ماشيين في الشارع,جوج نسا كيمشيو فالشعرة  
702,702,1777816180_08d7e8063b.jpg,صبي يستعد للقفز من صخرة,ولاد بيستعد يقفز من على صخرة,ولد صغير كيحضر ليكيد من صخرة  
703,703,1778020185_1d44c04dae.jpg,كلب أبيض وكلب بني يلعبان في العشب,كلب أبيض وكلب بني بيلعبوا في العشب,كلب أبيض و كلب بني كاي لعبو فالعشب  
704,704,1781227288_6811e734be.jpg,رجل يرتدي اصفر يقف في نفق متناثر,راجل لابس أصفر واقف في نفق مترب,راجل لابس أصفر واقف فممر متناثر  
705,705,1784309115_0ad6791146.jpg,فتاة في ثوب السباحة تتحدث مع رجل,بنت في بدلة سباحة بتكلم مع راجل,بنت فلبسة ديال البحر كاتهضر مع راجل  
706,706,1785138090_76a56aaabc.jpg,امرأة ترتدي ثوب السباحة,ست بتلبس بدلة سباحة,مراة لابسة لبسة ديال البحر  
707,707,1786425974_c7c5ad6aa1.jpg,كلب أصغر يشم كلب أكبر في التلال,كلب صغير بيشم كلب كبير في التلال,كلب صغير كيشوف كلب كبير فالتلال  
708,708,1787222774_d5c68cce53.jpg,يركب طفلان عربة حمراء في محطة وقود حقيقية,اتنين ولاد راكبين عربية حمرا في محطة بنزين,جوج ولاد كاي ركبو عربة حمراء فمحطة بنزين  
709,709,179009558_69be522c63.jpg,كلب أبيض وأسود يكمن على الأرض بجوار فتاة صغيرة على دراجة حمراء في الغابة,كلب أبيض وأسود نايم على الأرض جنب بنت صغيرة على دراجة حمرا في الغابة,كلب أبيض و أسود كاي نخب فالأرض بجوار بنت صغيرة على دراجة حمراء فالغابة  
710,710,1794818900_e0ffdd268e.jpg,فتاة تلعب على لعبة حمراء,بنت بتلعب على لعبة حمرا,بنت كتلعب على لعبة حمراء  
711,711,1795151944_d69b82f942.jpg,فريق من الكلاب  وامرأة تتابع على الدراجة,فريق من الكلاب وست بتجري على دراجة,مجموعة من الكلاب و مراة كاي تابعو على الدراجة  
712,712,1797507760_384744fb34.jpg,يتسلل أربعة رجال بلا أكمام إلى الوادي,أربعة رجالة بلا كم بيدخلوا الوادي,أربعة رجال بلا كم كاي دوزو فوادي  
713,713,1797554350_20998753c0.jpg,يجري إيواء أحد عداء ببطء مع مظلة,عداء بيجري ببطء مع مظلة,كاي هربوا واحد عداء ببطء مع مظلة  
714,714,1798209205_77dbf525b0.jpg,امرأة شقراء الشعر تسكب المشروبات في حانة,ست شعرها أشقر بتسكب مشروبات في حانة,مراة بشعر أصفر كاتهز المشروبات فحانوت  
715,715,1798215547_ef7ad95be8.jpg,ينزلق صبي يرتدي الأزرق الداكن على زحلوقة رمادية,ولاد لابس أزرق غامق بينزلق على زلاجة رمادية,ولد لابس أزرق غامق كاي نزل فزلاجة رمادية  
716,716,179829865_095b040377.jpg,رجل يمسك بمقبض في الماء,راجل ماسك في مقبض في الميه,راجل كاي مسك فشي حاجة فالمياه  
717,717,1799188614_b5189728ba.jpg,صبي في ملابس السباحة يمشي في الرمال نحو الماء,ولاد في ملابس سباحة ماشي في الرمال ناحية الميه,ولد فلبسة ديال البحر كاي مشي فالسند نحو الميه  
718,718,1799271536_6e69c8f1dc.jpg,حيوان يمر عبر الرمال على الشاطئ,حيوان بيمشي في الرمال على الشاطئ,حيوان كاي دوز فالسند على الشاطئ  
719,719,1800601130_1c0f248d12.jpg,كلب بني يقفز وراء كرة التنس,كلب بني بيقفز ورا كورة تنس,كلب بني كاي طيح وراء كرة التنس  
720,720,180094434_b0f244832d.jpg,بعض الأولاد يلعبون حول نافورة,شوية ولاد بيلعبوا حوالين نافورة,شي ولاد كاي لعبو حول نافورة  
721,721,1801063894_60bce29e19.jpg,تقف فتاة ترتدي بذلة صفراء على صخرة فوق جسم من الماء,بنت لابسة بدلة صفرا واقفة على صخرة فوق جسم من الميه,بنت لابسة لبسة صفراء واقفة على صخرة فوق ميه  
722,722,1801188148_a176954965.jpg,أربع كلاب تجري في العشب,أربعة كلاب بيجرى في العشب,أربعة كلاب كاي هربو فالعشب  
723,723,1801663973_5ad393caeb.jpg,فتاة ترقد على الشجرة مع صبي راكع أمامها,بنت نايمة على الشجرة مع ولاد راكب قدامها,بنت كاي تنام على الشجرة مع ولد كاي ركع قدامها  
724,724,1801874841_4c12055e2f.jpg,الكلب البني يحدق في كلب أبيض ناصع وأبيض,الكلب البني باصص لكلب أبيض ناصع,كلب بني كاي عيط ل كلب أبيض نقي  
725,725,1802092493_7b44fdb6b9.jpg,أربعة أطفال صغار يقفون رسمياً صورة غير رسمية,أربعة ولاد صغيرين واقفين رسمي صورة غير رسمية,أربعة ولاد صغار واقفين رسميا صورة غير رسمية  
726,726,1803631090_05e07cc159.jpg,امرأة ترتدي زي رجال الاطفاء,ست لابسة زي رجال الإطفاء,مراة لابسة لباس ديال رجال المطافئ  
727,727,180506881_de0f59770f.jpg,تركز الكاميرا على ساقي شخصين,الكاميرا مركز على رجلين شخصين,الكاميرا كاتهز على رجلين ديال جوج ناس  
728,728,1805990081_da9cefe3a5.jpg,صبي في قميص مخطط يمشي كلبًا صغيرًا على مقود,ولاد في قميص مخطط ماشي كلب صغير على سلسلة,ولد فلبسة مخطط كاي مشي كلب صغير على سلسلة  
729,729,1806580620_a8fe0fb9f8.jpg,سيدة شقراء مع النظارات الشمسية تبتسم,ست شعرها أشقر مع نظارة شمس بتبتسم,مراة بشعر أصفر مع النظارات الشمسية كاتهز  
730,730,1807169176_7f5226bf5a.jpg,يتم تجميع الناس حول نار في الليل,الناس متجمعين حوالين نار في الليل,ناس كاي تجمعو حول نار فليل  
731,731,1808007704_ee8a93abb4.jpg,رجل يتدلى من على حافة صخرة بينما يمسكه اثنان آخران,راجل متدلي من على حافة صخرة واثنين تانيين ماسكين فيه,راجل كاي يهبط من صخرة و جوج اخرين كاي مسكون فيه  
732,732,1808370027_2088394eb4.jpg,كلب يسبح نحو شلال,كلب بيسبح ناحية شلال,كلب كاي سبح نحو شلال  
733,733,1808504612_3508f3c9bb.jpg,أطفال يتسلقون شجرة ضخمة,ولاد بيتسلق شجرة كبيرة,ولاد كاي تسلقو شجرة كبيرة  
734,734,1809758121_96026913bb.jpg,فتاة تقفز من صخرة إلى أخرى في الخور,بنت بتقفز من صخرة لتانية في الخور,بنت كاي طيح من صخرة ل صخرة فوادي  
735,735,1809796012_a2dac6c26b.jpg,كلب أبيض وأسود يقف على رجليه الخلفيتين,كلب أبيض وأسود واقف على رجليه الخلفية,كلب أبيض و اسود واقف على رجليه الخلفية  
736,736,1810651611_35aae644fb.jpg,لقطة مقرّبة لفتاة صغيرة على أرجوحة,كاميرا قريبة لبنت صغيرة على أرجوحة,صورة قريبة لبنت صغيرة على المرجوحة  
737,737,181103691_fb2f956abd.jpg,أطفال يلعبون في الماء,ولاد بيلعبوا في الميه,ولاد كاي لعبو فالمياه  
738,738,181157221_e12410ef0b.jpg,يمشي رجل وامرأة كلابهما باحبال,راجل وست ماشيين كلابهم على سلاسل,راجل و مراة كاي مشيو كلابهم على سلاسل  
739,739,1812525037_528465037c.jpg,طفلان يرتديان زي قبلة مع والديهما,اتنين ولاد لابسين زي قبلة مع والدينهم,جوج ولاد كاي لبسو لباس ديال القبلة مع ولديهم  
740,740,1813266419_08bf66fe98.jpg,فتاة تلعب في نافورة,بنت بتلعب في نافورة,بنت كتلعب فنافورة  
741,741,1813597483_3f09d2a020.jpg,كلب يقفز فوق جذع في الغابة,كلب بيقفز فوق جذع في الغابة,كلب كاي طيح فوق ساق شجرة فغابة  
742,742,1813777902_07d1d4b00c.jpg,طفل يرتدي زي القراصنة يبتسم,ولاد لابس زي قراصنة بيبتسم,ولد لابس لباس ديال القراصنة كاي هز  
743,743,1814086703_33390d5fc7.jpg,كلب ينظر وراءه,كلب باصص ورا ضهره,كلب كاي شوف وراه  
744,744,181415975_2627aa6668.jpg,رجل أشقر يقفز في الهواء فوق المحيط,راجل أشقر بيقفز في الهوا فوق البحر,راجل بشعر اصفر كاي طيح فالسماء فوق البحر  
745,745,1814391289_83a1eb71d3.jpg,صبي يرتدي زي سبايدرمان يدق جرس الباب,ولاد لابس زي سبايدرمان بيخبط على جرس الباب,ولد لابس لباس ديال سبايدرمان كاي دق فجرس الباب  
746,746,181777261_84c48b31cb.jpg,شاطئ مزدحم مع مرتادي الشواطئ,شاطئ زحمة مع مرتادي الشواطئ,شاطئ مليان بالناس  
747,747,1818403842_553a2a392c.jpg,الكلاب السوداء تقفز في بركة إلى يد,كلاب سوداء بتقفز في بركة ليد,كلاب سوداء كاي طيحو فبركة ليد  
748,748,1819261140_6c022f4b1d.jpg,رقم مموه يميل إلى مائدة العشاء,رقم مخفي بيميل لميدون عشاء,رقم مخبي كاي دوز ل طاولة العشا  
749,749,1821238649_2fda79d6d7.jpg,فتاة ترتدي الزي الأحمر الشيطاني,"بنت لابسة زي أحمر شيطاني 
", بنت لابسة لباس أحمر ديال شيطان 
750,750,182493240_40410254b0.jpg,رجلان يرفعان ذراعيهما فوق جبل ثلجي,اتنين رجالة بيشيلوا دراعاتهم فوق جبل فيه تلج,جوج رجال كا رفعين يديهوم فوق جبل تلج
751,751,1827560917_c8d3c5627f.jpg,كلب مع حزام ولعبة فمه,كلب لابس حزام و ماسك لعبة في بقه,كلب مع حزام و لعيبة ف فمه
752,752,1835511273_790eaae6e6.jpg,رجل يرتدي الزي الأحمر,راجل لابس لبس أحمر,راجل لابس لبسة حمرا
753,753,1836335410_de8313a64e.jpg,رجل يرتدي الزي الأسود يمسك بسيف متوهج,راجل لابس لبس أسود ماسك سيف بيلمع,راجل لابس لبسة سودا كا مسك سيف شاعل
754,754,1837976956_3c45d0f9b8.jpg,فتاة في ثوب البولكا دوت تغني في الميكروفون,بنت لابسة فستان نقط بيغني في الميكروفون,بنت ف لبسة بولكا دوت كا غني ف الميكروفون
755,755,185057637_e8ada37343.jpg,مجموعة من خمسة أشخاص تقف في الهواء الطلق,جموعة من خمسة ناس واقفين في الهوا,مجموعة ديال خمسة ديال الناس واقفين ف الهواء الطلق
756,756,1858963639_4588cd4be9.jpg,فتاة ذات خوذة حمراء تحمل الكثير من الحبال,بنت لابسة خوذة حمرا شايلة حبال كتير,بنت عندها خوذة حمرا كا حملة بزاف ديال الحبال
757,757,185972340_781d60ccfd.jpg,رجل يقود سيارة جيب خضراء على بعض الصخور المتعرجة,راجل بيسوق عربية جيب خضرا على صخور متعرجة,راجل كا سواق جيب خضرا على بعض الصخور متعرجة
758,758,1859726819_9a793b3b44.jpg,امرأة بالضيق مع مكياجها ينساب على وجهها من دموعها,ست لابسة ضيق و مكياجها نازل على وشها من دموعها,مرا بالضيق مع مكياجها كا ينساب على وجهها من دموعها
759,759,1859941832_7faf6e5fa9.jpg,كلب يصطاد الفريسبي وهو يقفز على العشب,كلب بيطارد فريسبي و هو بيقفز على العشب,كلب كا صيد فريسبي و هو كا طلع على العشب
760,760,1860543210_47e94cf652.jpg,رجل يرتدي يسير عبر الشارع ليلاً,راجل لابس بيعدي من الشارع بالليل,راجل لابس كا مشي ف الشارع بالليل
761,761,186346360_541047336f.jpg,تقف فتاة في الجزء العلوي من البيكيني أمام منظر جميل,بنت واقفة في الجزء العلوي من البيكيني قدام منظر حلو,بنت واقفة ف الجزء العلوي ديال البيكيني أمام منظر جميل
762,762,186348874_75b2cf1ec5.jpg,مجموعة من السائقين في الغابة,جموعة من السواقين في الغابة,مجموعة ديال سواقين ف الغابة
763,763,1865794069_6e3a1e57bb.jpg,فتى أشقر يرتدي الزي الأزرق الداكن يركل كرة قدم في ملعب مفتوح,ولد أشقر لابس لبس أزرق غامق بيركل كرة قدم في ملعب مفتوح,وليد أشقر لابس لبسة زرقا داكنة كا ركل كرة قدم ف ملعب مفتوح
764,764,186890601_8a6b0f1769.jpg,رجل يتأرجح فوق حبل فوق الماء,راجل بيتأرجح على حبل فوق الميه,راجل كا يتأرجح فوق حبل فوق الماء
765,765,186890605_ddff5b694e.jpg,رجل يتأرجح من شجرة إلى بحيرة,راجل بيتأرجح من شجرة لبحيرة,راجل كا يتأرجح من شجرة ل بحيرة
766,766,1874617189_e85d3f4326.jpg,ثلالثة يجلسون بالماء,تلاتة قاعدين في الميه,ثلاثة كا جلسين ف الماء
767,767,1876536922_8fdf8d7028.jpg,كلبان يحملان لعبة خارج المحيط,اتنين كلاب شايلين لعبة برة المحيط,جوج كلاب كا حملين لعيبة خارج المحيط
768,768,1881494074_1bebd93089.jpg,رجل يحمل طفله بينما تأخذ المرأة صورة للطفل,راجل شايل ابنه و الست بتصور الولد,راجل كا حملة ولده بينما مرا كا تاخذ صورة ديال ولده
769,769,1884065356_c6c34b4568.jpg,كلب أسود في الماء,كلب أسود في الميه,كلب اسود ف الماء
770,770,1884727806_d84f209868.jpg,رجل وامرأة يرتديان آذان ميكي ماوس يقفان في حشد من الناس,راجل و ست لابسين ودان ميكي ماوس واقفين في زحمة ناس,راجل و مرا لابسين آذان ميكي ماوس واقفين ف حشد ديال الناس
771,771,1895768965_43cd9d164f.jpg,كلب أبيض وأسود يركض فوق بعض الأوراق,كلب أبيض و أسود بيجري فوق ورق,كلب ابيض واسود كا ركض فوق بعض الأوراق
772,772,1897025969_0c41688fa6.jpg,كلب أسود وكلب أسمر يتقاتلان,كلب أسود و كلب بني بيتخانقوا,كلب اسود و كلب بني كا يتقاتلون
773,773,189721896_1ffe76d89e.jpg,رجل يرتدي قميصا أحمر يتسلق الحائط الصخري,راجل لابس قميص أحمر بيتسلق حيط صخري,راجل لابس قميص احمر كا تسلق الحائط الصخري
774,774,189740668_0b045f1ff2.jpg,رجل يصعد صخرة كبيرة,راجل بيطلع صخرة كبيرة,راجل كا طلع صخرة كبيرة
775,775,1904112245_549e47c8aa.jpg,كلب في الغابة,كلب في الغابة,كلب ف الغابة
776,776,190638179_be9da86589.jpg,رجل يرتدي قبعة واقف خارج سيارته جيب جراندلر الخضراء,راجل لابس قبعة واقف برة عربيته جيب جراندلر الخضرا,راجل لابس قبعة واقف خارج سيارته جيب جراندلر الخضرا
777,777,190965502_0b9ed331d9.jpg,العديد من الكراسي فارغة مع عدد قليل من الأشخاص الذين يستمتعون بالشمس,كراسي كتير فاضية مع ناس قليلة مستمتعين بالشمس,بزاف ديال الكراسي خاوين مع عدد قليل ديال الناس اللي كا استمتعون بالشمس
778,778,191003283_992257f835.jpg,صبي صغير أشقر وشابة في الجينز يمشون في ساحة,ولد صغير أشقر و ست في جينز ماشيين في ساحة,وليد صغير أشقر و شابة ف الجينز كا مشيو ف ساحة
779,779,191003284_1025b0fb7d.jpg,رجل يساعد فتاة صغيرة ركوب الدراجة,راجل بيساعد بنت صغيرة تركب الدراجة,راجل كا ساعد بنت صغيرة ركوب الدراجة
780,780,191003285_edd8d0cf58.jpg,رجل وفتاة يجلسان على الأرض ويأكلان,راجل و بنت قاعدين على الأرض و بياكلوا,راجل و بنت كا جلسين على الأرض و كا كلو
781,781,191003287_2915c11d8e.jpg,أب يطعم طفله في الشارع,أبو بياكل ابنه في الشارع,اب كا طعم ولده ف الشارع
782,782,191592626_477ef5e026.jpg,المتسلق يتسلق جرف الجبل,متسلق بيتسلق جرف الجبل,متسلق كا تسلق جرف الجبل
783,783,1917203130_fcaff8b10e.jpg,طفل في معرض,طفل في معرض,وليد ف معرض
784,784,1917265421_aeccf1ca38.jpg,أطفال يلعبون مع خنزير,أطفال بيلعبوا مع خنزير,وليدات كا يلعبون مع خنزير
785,785,1918573100_d31cbb6b77.jpg,كلب أبيض وأسود يتوازن على لوح خشبي,كلب أبيض و أسود بيتوازن على لوح خشب,كلب ابيض واسود كا توازن على لوح خشبي
786,786,19212715_20476497a3.jpg,رجل يجذف من خلال الماء,راجل بيجدف في الميه,راجل كا تجدف من خلال الماء
787,787,1921398767_771743bf4e.jpg,كلب على الشاطئ يسحب شيئا,كلب على الشاطئ بيسحب حاجة,كلب على الشاطئ كا سحب شي حاجة
788,788,1923476156_e20976b32d.jpg,كلب أبيض يقوده شخص على دراجة هوائية,كلب أبيض حد بيشيله على دراجة,كلب ابيض كا يقوده شخص على دراجة هوائية
